iteration	timestamp	asset	timeframe	status	oos_brier	oos_ece	backtest_pnl	backtest_sharpe	description	commit	bs_pnl	bs_sharpe	backtest_max_dd	backtest_trades	backtest_win_rate	oos_accuracy	hpo_objective
102	2026-03-23T00:30:00Z	XRP	1h	KEEP	0.226947	0.0356	75.23	73.09	XRP/1h multi-tp revalidation (OVERRIDE item 12, 12/12 FINAL) -- time_pcts=[0.10,0.20,0.40,0.60,0.80] multi-point training, 5 samples/bar, TimeAwareCalibrator per-bucket; overall Brier=0.226947 (multi-tp avg, +16.6102 2026-03-23T00:30:00Z XRP 1h KEEP 0.226947 0.0356 75.23 73.09 XRP/1h multi-tp revalidation (OVERRIDE item 12, 12/12 FINAL) -- time_pcts=[0.10,0.20,0.40,0.60,0.80] multi-point training, 5 samples/bar, TimeAwareCalibrator per-bucket; overall Brier=0.226947 (multi-tp avg, +16.6pct vs single-point 0.194578 -- XRP tick-dominant flat pattern, consistent with XRP/15m +13.6pct XRP/5m +14pct); ECE=0.0356 PASS; overall backtest WR=51.38pct -- XRP tick-dominant FLAT pattern confirmed; model saved to data/models/pulse_v2/XRP_1h; train_bars=10000 purge_period=24 n_splits=8 (XRP-optimal); HPO 40/40 trials (fast mode, full search); top features: partial_bar_position, bar_position, regime_vol_zscore, body_ratio, vol_ratio, distance_from_open, rsi_7, rsi_14, parkinson_vol_10, macd_histogram; best_params: lr=0.065, max_depth=6, num_leaves=34, reg_alpha=3.1e-05, reg_lambda=0.0016; KEEP as new multi-tp XRP/1h baseline; OVERRIDE COMPLETE -- 12/12 multi-tp revalidation done; all pulse_v2 models saved	-	6013485.71	73.01	0.0625	19292	0.5138	0.6295	0.461608
103	2026-03-23T01:00:00Z	BTC	1h	DISCARD	0.177374	0.0142	11.41	19.91	autonomous HPO narrowing (post-OVERRIDE): narrowed lr=[0.015,0.065] max_depth=[3,6] based on convergence data from iters 92-102; Brier 0.177374 regressed vs best 0.175668 for BTC/1h -- lr=0.009 (iter 99 optimal) below new lower bound; HPO 40/40 trials; top features: vol_norm_distance, distance_from_open, partial_bar_position, time_remaining_pct, elapsed_pct; best_params: lr=0.025, max_depth=5, num_leaves=63, min_child=468; BTC sniper WR=59 onfirmed; FAIL: Brier 0.177374 > best 0.175668	-	161778.25	13.06	0.2762	16642	0.59	0.7234	0.175675
104	2026-03-23T04:30:00Z	BTC	5m	KEEP	0.17605	0.0056	56.39	79.07	BTC/5m full HPO re-run (strategy priority #1) -- no knob changes, increased HPO coverage; Brier=0.17605 improvement from iter 92 best 0.177295 (0.70pct improvement); ECE=0.0056 PASS; time-bucket WRs: t10(30-60s)=58.7pct, t20(60-120s)=62.5pct, t40(120-180s)=73.3pct, t80(180-295s)=83.4pct -- BTC sniper ramp pattern confirmed; model saved to data/models/pulse_v2/BTC_5m; 11 HPO trials ran (timeout 384s/420s); top features: vol_norm_distance, distance_from_open, partial_bar_position, time_remaining_pct, elapsed_pct, trade_intensity, rsi_7, partial_range, rsi_14, volume_ratio_partial; best_params: lr=0.058, max_depth=5, num_leaves=98, min_child=794, reg_lambda=0.586; improvement 0.70pct < 2pct threshold, no verification run	-	1787253.97	70.61	0.3901	80966	0.6681	0.7263	0.168256
105	2026-03-23T05:30:00Z	BTC	15m	DISCARD	0.172041	0.0114	48.89	51.49	BTC/15m full HPO re-run (strategy priority #2) -- no knob changes, increased HPO coverage; Brier=0.172041 regressed vs best 0.171913 (+0.075pct); ECE=0.0114 PASS; time-bucket WRs: t20(60-120s)=54.0pct, t80(180-295s)=61.3pct -- BTC sniper ramp pattern confirmed; 15 HPO trials ran (timeout 429s/420s); top features: vol_norm_distance, distance_from_open, partial_bar_position, elapsed_pct, time_remaining_pct, trade_intensity, rsi_7, rsi_14, bar_position, parkinson_vol_10; best_params: lr=0.012, max_depth=5, num_leaves=31, min_child=363, reg_alpha=0.117; FAIL: Brier 0.172041 > best 0.171913; HPO starvation continues (15/40 trials); DISCARD	-	692705.91	41.68	0.1779	61758	0.6588	0.735	0.175432
106	2026-03-23T06:15:00Z	BTC	1h	DISCARD	0.176508	0.015	11.76	20.98	BTC/1h min_child_samples narrowing [400,800] + num_leaves [16,64] (strategy priority #3) -- Brier=0.176508 regressed vs best 0.175668 (+0.049pct); 40/40 HPO trials; lr=0.056 (non-sniper mode), max_depth=5, num_leaves=64 (hit ceiling), min_child=616 (confirms [400,800] correct); DISCARD: Brier above BTC/1h best 0.175668; WARNING: Sharpe 20.98>5.0 (consistent with prior BTC/1h backtest pattern, not new leakage)	-	171148.08	14.83	0.2245	16603	0.6033	0.7225	0.175659
107	2026-03-23T20:11:00Z	BTC	1h	KEEP	0.174864	0.0122	12.0	23.61	BTC/1h num_leaves [32,96] + lr [0.005,0.03] (strategy priority #4) -- Brier=0.174864 improvement from iter 99 best 0.175668 (0.46pct); 13/40 HPO trials (timeout 490s/420s); lr=0.008425 confirms BTC sniper zone discoverable only with lower bound 0.005; num_leaves=41 within [32,96]; min_child=363 (below iter 106 [400,800] narrowing -- prior narrowing was wrong); ECE=0.0122 PASS; top features: distance_from_open, vol_norm_distance, partial_bar_position, time_remaining_pct, elapsed_pct; best_params: lr=0.008, max_depth=5, num_leaves=41, min_child=363, reg_alpha=0.117; WARNING: Sharpe=23.61>5.0 (consistent BTC/1h pattern, not new leakage)	-	177082.42	18.59	0.2333	16213	0.6347	0.7256	0.175783
108	2026-03-23T21:00:00Z	ETH	1h	DISCARD	0.215779	0.0175	73.58	71.2	ETH/1h min_child_samples [200,600] (strategy priority #5) -- narrowed min_child from [100,1000] to [200,600]; Brier=0.215779 regressed vs best 0.211438 (+2.05pct); 40/40 HPO trials (full); min_child=439 confirms search in [200,600] range but no improvement; ETH tick-dominant pattern: WR=50.49pct, flat across buckets; top features: partial_bar_position, partial_range, bar_position, rsi_14, rsi_7; best_params: lr=0.033, max_depth=4, num_leaves=23, min_child=439, reg_alpha=0.032; WARNING: Sharpe=71.2>5.0 (consistent ETH/1h pattern); DISCARD: Brier above best 0.211438	-	5891600.0	71.37	0.075	19303	0.5049	0.6501	0.39572
109	2026-03-23T21:45:00Z	SOL	15m	DISCARD	0.215444	0.0115	288.8	143.09	SOL/15m additional HPO trials (strategy priority #6) -- no knob changes, increased HPO coverage; Brier=0.215444 marginally regressed vs best 0.215443 (+0.0005pct); 16/40 HPO trials (timeout 512s/420s -- same starvation as iter 96); tick-dominant pattern: WR=49.81pct flat; top features: partial_bar_position, partial_range, bar_position, volume_sma_10, rsi_7; best_params: lr=0.018, max_depth=6, num_leaves=59, min_child=416, reg_alpha=0.000419; SOL/15m HPO starvation structural (16/40 trials each time); WARNING: Sharpe=143.09>5.0 (consistent SOL/15m pattern); DISCARD: Brier 0.215444 >= best 0.215443	-	23061542.86	142.33	0.0587	75450	0.4981	0.6541	0.364185
110	2026-03-24T21:04:00Z	ETH	15m	KEEP	0.208899	0.0197	291.71	141.81	ETH/15m full HPO re-run (strategy priority #1) -- no knob changes, train_bars=14000; Brier=0.208899 improvement from iter 96 best 0.209819 (0.44pct improvement); only 2/40 HPO trials ran (timeout 1313s/420s -- severe starvation vs 19/40 at iter 96); lr=0.005318 (below prior lower bound, new exploration needed), max_depth=6, num_leaves=110, min_child=291; tick-dominant FLAT pattern: WR=50.11pct, consistent with prior ETH/15m; top features: partial_bar_position, partial_range, elapsed_pct, time_remaining_pct, rsi_7; WARNING: Sharpe=141.81>5.0 (consistent ETH/15m tick-dominant pattern); model saved to data/models/pulse_v2/ETH_15m; KEEP as new ETH/15m best; improvement 0.44pct < 2pct threshold, no verification run	-	23324357.14	142.55	0.0875	76262	0.5011	0.6704	0.31207111
111	2026-03-24T21:35:00Z	SOL	5m	DISCARD	0.218705	0.0071	297.91	239.02	SOL/5m HPO re-run (strategy priority #2) -- no knob changes, train_bars=10000, purge_period=24; Brier=0.218705 regressed vs best 0.218209 (+0.23pct); only 2/40 HPO trials (timeout 1185s/420s -- severe starvation, same pattern as ETH/15m iter 110); lr=0.005318 identical to ETH/15m iter 110 (same HP corner at lower bound when only 2 trials); tick-dominant FLAT pattern: WR=49.36pct consistent across buckets; top features: partial_bar_position, partial_range, elapsed_pct, time_remaining_pct, trade_intensity; best_params: lr=0.005318, max_depth=6, num_leaves=110, min_child=291; WARNING: Sharpe=239.02>5.0 (consistent SOL/5m tick-dominant pattern); DISCARD: Brier 0.218705 > best 0.218209	-	68251471.43	238.37	0.0688	80785	0.4936	0.6444	0.464439
112	2026-03-24T22:05:00Z	XRP	5m	KEEP	0.221503	0.0069	302.18	241.74	XRP/5m HPO re-run (strategy priority #3) -- no knob changes, train_bars=10000, purge_period=24; Brier=0.221503 improvement from iter 94 best 0.221782 (0.13% improvement); only 12/40 HPO trials (timeout 423s/420s -- severe starvation, worse than iter 94 24/40); tick-dominant FLAT pattern: WR=49.81% consistent across buckets (t10=49.81%, t80=50.10%); top features: partial_bar_position, partial_range, time_remaining_pct, elapsed_pct, distance_from_open; best_params: lr=0.0116, max_depth=4, num_leaves=31, min_child=822, reg_alpha=0.089, reg_lambda=1e-6; improvement 0.13% < 2% threshold, no verification run; WARNING: Sharpe=241.74>5.0 (consistent XRP/5m tick-dominant pattern); KEEP as new XRP/5m best	db29c4c	69270200.0	242.45	0.0688	80783	0.4981	0.6374	0.463428
113	2026-03-24T22:35:00Z	ETH	1h	DISCARD	0.211536	0.0185	73.56	71.49	ETH/1h reg_lambda widening [1.0, 20.0] (strategy priority #4) -- widened reg_lambda from [1e-8, 10.0] to [1.0, 20.0]; Brier=0.211536 marginally regressed vs best 0.211438 (+0.047%); 32/40 HPO trials; HPO found optimal at reg_lambda=1.396537 (near new lower bound 1.0, NOT upper bound 20.0 -- ETH/1h does NOT prefer high L2 regularization in multi-tp regime); best_params: lr=0.008287, max_depth=4, num_leaves=38, min_child=968, reg_alpha=5.3e-05, reg_lambda=1.396537; tick-dominant FLAT pattern: WR=50.49% consistent with prior ETH/1h; top features: partial_bar_position, partial_range, elapsed_pct, time_remaining_pct, bar_position, rsi_14, rsi_7, volume_ratio_partial, volume_sma_10, distance_from_open; WARNING: Sharpe=71.49>5.0 (consistent ETH/1h tick-dominant pattern); DISCARD: Brier 0.211536 > best 0.211438; reg_lambda reverted to [1e-8, 10.0]	-	5884728.57	71.5	0.075	19120	0.5049	0.6639	0.395946
114	2026-03-25T00:00:00Z	BTC	15m	DISCARD	0.172031	0.0164	48.51	51.43	BTC/15m train_bars=7500 timeout fix (strategy priority #5) -- reduced train_bars from 10000 to 7500 to escape HPO starvation; Brier=0.172031 regressed vs best 0.171913 (+0.069%); 17/40 HPO trials (modest improvement from 15/40 but still starved); best_params: lr=0.021, max_depth=6, num_leaves=43, min_child=620, reg_alpha=7.1e-05, reg_lambda=2.1e-05; BTC sniper RAMP pattern confirmed: t20(60-120s)=WR51.8%, t80(180-295s)=WR58.6%; top features: vol_norm_distance, distance_from_open, elapsed_pct, time_remaining_pct, partial_bar_position, trade_intensity, rsi_7, rsi_14, regime_vol_zscore; insight: train_bars=7500 only marginally improved trial count (17 vs 15) -- starvation is likely from per-fold training time not total dataset size; train_bars reverted to 10000; WARNING: Sharpe=51.43>5.0 (consistent BTC/15m sniper pattern); DISCARD: Brier 0.172031 > best 0.171913	-	693485.58	40.32	0.1644	60725	0.6541	0.7353	0.175658
115	2026-03-25T02:00:00Z	XRP	1h	KEEP	0.226907	0.0356	75.23	73.09	XRP/1h HPO re-run (strategy priority #1) -- num_leaves=[16,128] already in place; fresh 40/40 HPO trials (no starvation, 266s); Brier=0.226907 marginal improvement from iter 102 best 0.226947 (0.018% improvement); HPO consistently finds num_leaves=34 optimum -- shallow-tree hypothesis (num_leaves<32) NOT confirmed, 34 is robust optimum; best_params: lr=0.065479, max_depth=6, num_leaves=34, min_child=326, reg_alpha=3.1e-05, reg_lambda=0.001637; tick-dominant FLAT pattern: WR=51.38% consistent across buckets; top features: partial_bar_position, bar_position, regime_vol_zscore, body_ratio, vol_ratio, distance_from_open, rsi_7, rsi_14, parkinson_vol_10, macd_histogram; improvement 0.018% < 2% threshold, no verification run; WARNING: Sharpe=73.09>5.0 (consistent XRP/1h tick-dominant pattern); model saved to data/models/pulse_v2/XRP_1h; KEEP as new XRP/1h best	-	6013485.71	73.01	0.0625	19292	0.5138	0.6298	0.461608
116	2026-03-25T03:30:00Z	ETH	15m	KEEP	0.208324	0.0234	292.26	142.3	ETH/15m anti-starvation n_estimators=[100,800] (strategy priority #2) -- reduced n_estimators ceiling from 1500 to 800 to fix HPO starvation; fixed 23/40 trials (vs 2/40 in iter 110 -- major improvement); Brier=0.208324 improvement from iter 110 best 0.208899 (0.275% improvement); best_params: n_estimators=202, lr=0.03129, max_depth=6, num_leaves=70, min_child=989, reg_alpha=0.0, reg_lambda=2.2e-05; n_estimators=202 well below old ceiling 1500 -- confirms upper bound was wasted; tick-dominant FLAT pattern: WR=50.11% consistent across buckets; top features: partial_bar_position, partial_range, time_remaining_pct, elapsed_pct, rsi_7, trade_intensity, parkinson_vol_10, bar_position, distance_from_open, volume_ratio_partial; improvement 0.275% < 2% threshold, no verification run; WARNING: Sharpe=142.3>5.0 (consistent ETH/15m tick-dominant pattern); model saved to data/models/pulse_v2/ETH_15m; KEEP as new ETH/15m best	-	23349057.14	141.96	0.0875	77061	0.5011	0.6726	0.294821
117	2026-03-25T05:00:00Z	ETH	5m	KEEP	0.211888	0.0058	307.53	245.15	ETH/5m multi-tp baseline (strategy priority #3) -- first multi-tp ETH/5m run (OVERRIDE phase skipped ETH/5m); n_estimators=[100,800] anti-starvation from item 2 KEEP; 23/40 HPO trials (excellent coverage vs 0 prior multi-tp runs); Brier=0.211888 establishes multi-tp baseline; improvement vs single-tp 0.177772 not expected (multi-tp trains on all 5 time buckets); best_params: n_estimators=182, lr=0.034505, max_depth=6, num_leaves=70, min_child=389; tick-dominant FLAT pattern: WR=49.77 onsistent across buckets; top features: partial_bar_position, partial_range, elapsed_pct, time_remaining_pct, trade_intensity, distance_from_open, parkinson_vol_10, volume_ratio_partial, rsi_7, rsi_14; no funding/alpha features in top-10; model saved to data/models/pulse_v2/ETH_5m; WARNING: Sharpe=245.15>5.0 (consistent ETH/5m tick-dominant pattern); KEEP as new ETH/5m multi-tp baseline	-	69706671.43	246.27	0.0687	81000	0.4977	0.6579	0.279499
118	2026-03-25T07:00:00Z	SOL	1h	DISCARD	0.223609	0.0171	71.08	68.94	SOL/1h HPO re-run (strategy priority #4) -- no knob changes, train_bars=10000, purge_period=24; Brier=0.223609 regressed vs best 0.221683 (+0.086pct); 40/40 HPO trials (no starvation, 209s -- SOL/1h 1h timeframe confirmed starvation-free); best_params: n_estimators=419, lr=0.080, max_depth=6, num_leaves=84, min_child=835, reg_alpha=8.55, reg_lambda=1e-6; tick-dominant FLAT pattern: WR=49.21pct consistent across buckets; top features: partial_bar_position, partial_range, macd_histogram, vol_ratio, bar_position, volume_sma_10, rsi_7, body_ratio, distance_from_open, regime_vol_zscore; regime_vol_zscore in top-10 (consistent with XRP pattern); HPO converges to high reg_alpha=8.55 (novel for SOL/1h); FAIL: Brier 0.223609 > best 0.221683; WARNING: Sharpe=68.94>5.0 (consistent SOL/1h tick-dominant pattern)	-	5677785.71	69.09	0.0875	19255	0.4921	0.6348	0.407012
119	2026-03-25T08:00:00Z	XRP	15m	DISCARD	0.219588	0.0217	295.21	142.96	XRP/15m HPO re-run (strategy priority #5) -- no knob changes, train_bars=10000, purge_period=24; Brier=0.219588 regressed vs best 0.218727 (+0.40pct); 22/40 HPO trials (moderate coverage, not starvation-prone but limited); tick-dominant FLAT pattern: WR=50.64pct consistent across buckets (t20=50.64pct, t80=50.64pct); top features: partial_bar_position, partial_range, distance_from_open, time_remaining_pct, bar_position, volume_sma_10, rsi_14, elapsed_pct, rsi_7, volume_ratio_partial; best_params: n_estimators=382, lr=0.042, max_depth=6, num_leaves=52, min_child=518, reg_alpha=8e-6, reg_lambda=0.0198; num_leaves=52 mid-range (different from XRP/5m num_leaves=31 shallow-tree optimum at 12/40 trials); no funding/alpha features in top-10 (consistent tick-dominant); FAIL: Brier 0.219588 > best 0.218727; WARNING: Sharpe=142.96>5.0 (consistent XRP/15m tick-dominant pattern)	-	23620314.29	143.28	0.075	77189	0.5064	0.6471	0.501459
120	2026-03-25T09:00:00Z	ETH	1h	DISCARD	0.211498	0.0186	73.59	71.4	ETH/1h lr narrowing [0.005, 0.05] (strategy priority #6) -- narrowed learning_rate from [0.005, 0.1] to [0.005, 0.05] and applied n_estimators=[100, 800] anti-starvation; Brier=0.211498 marginally regressed vs best 0.211438 (+0.028%); full 40/40 HPO trials (380s, no starvation -- ETH/1h confirmed starvation-free); best_params: n_estimators=381, lr=0.009036, max_depth=4, num_leaves=44, min_child=864, reg_alpha=0.074, reg_lambda=0.014; lr=0.009 inside narrowed range, confirming low-lr hypothesis but no improvement over baseline; tick-dominant FLAT pattern: WR=50.49% consistent; top features: partial_bar_position, partial_range, elapsed_pct, time_remaining_pct, bar_position, rsi_14, rsi_7, volume_ratio_partial, volume_sma_10, stoch_k; lr narrowing verdict: no improvement despite removing wasted high-lr region (0.05-0.10); all 6 strategy priority items now COMPLETE; WARNING: Sharpe=71.4>5.0 (consistent ETH/1h tick-dominant pattern)	-	5889142.86	71.46	0.075	19182	0.5049	0.6636	0.395774
121	2026-03-25T11:10:00Z	SOL	5m	KEEP	0.218058	0.0095	302.94	240.51	SOL/5m anti-starvation n_estimators=[100,800] (strategy priority #1 from strategy after iter 119) -- reduced n_estimators ceiling from 1500 to 800 to fix HPO starvation; 24/40 trials (vs 2/40 in iter 111 -- 12x improvement); Brier=0.218058 improvement from iter 93 best 0.218209 (0.069% improvement); best_params: n_estimators=274, lr=0.019, max_depth=6, num_leaves=47, min_child=544, reg_alpha=8e-6, reg_lambda=0.0; lr=0.019 confirms SOL tick-dominant lr~0.018 concentration; tick-dominant FLAT pattern: WR=49.41% consistent across buckets (t10=49.42%, t80=50.97%); top features: partial_bar_position, partial_range, trade_intensity, elapsed_pct, time_remaining_pct, parkinson_vol_10, volume_ratio_partial, rsi_14, distance_from_open, rsi_7; train_bars=10000 purge_period=24 n_splits=8 (SOL-optimal); improvement 0.069% < 2% threshold, no verification run; WARNING: Sharpe=240.51>5.0 (consistent SOL/5m tick-dominant pattern); KEEP as new SOL/5m best	-	68315328.57	241.02	0.0688	80783	0.4941	0.6441	0.455431
122	2026-03-20T16:39:00Z	BTC	5m	DISCARD	0.176238	0.0076	54.93	75.42	BTC/5m anti-starvation n_estimators=[100,800] (strategy priority #2) -- reduced n_estimators ceiling from 1500 to 800; 22/40 HPO trials (same starvation level as iter 104 11/40, slight improvement but still starving); Brier=0.176238 regressed vs best 0.17605 (+0.108%); best_params: n_estimators=709, lr=0.027, max_depth=6, num_leaves=17, min_child=995, reg_alpha=0.0, reg_lambda=0.059; num_leaves=17 (very shallow -- lowest yet for BTC); min_child=995 near ceiling; n_estimators=709 near [100,800] ceiling (starvation still occurs at BTC/5m scale); BTC sniper ramp confirmed: WR t10=52.1%, t20=58.4%, t40=72.1%, t80=83.1%; FAIL: Brier 0.176238 > best 0.17605; WARNING: Sharpe=75.42>5.0 (BTC sniper pattern); anti-starvation fix insufficient for BTC/5m -- dataset too large (929K samples/8 splits); may need further ceiling reduction or fold-time investigation	-	1693166.58	62.98	0.3851	80947	0.6577	0.7258	0.168164
123	2026-03-25T13:00:00Z	BTC	15m	KEEP	0.171809	0.0116	50.46	52.39	BTC/15m anti-starvation n_estimators=[100,800] (strategy priority #3 from strategy after iter 119) -- reduced n_estimators ceiling from 1500 to 800 to fix HPO starvation; 21/40 trials (improvement from 15-17/40 in iters 105/114); Brier=0.171809 improvement from iter 95 best 0.171913 (0.061% improvement); best_params: n_estimators=235 (well within ceiling, NOT near bound -- anti-starvation fix working), lr=0.021, max_depth=6, num_leaves=43, min_child=620, reg_alpha=7.1e-05, reg_lambda=2.1e-05; n_estimators=235 confirms [100,800] is correct range (prior 1500 ceiling was wasted); BTC sniper RAMP pattern confirmed: t20(60-120s)=WR54.5%, t80(180-295s)=WR61.5%; top features: vol_norm_distance, distance_from_open, elapsed_pct, time_remaining_pct, partial_bar_position, trade_intensity, rsi_7, rsi_14, regime_vol_zscore, volume_ratio_partial; train_bars=10000 purge_period=24 n_splits=8 (BTC-optimal); improvement 0.061% < 2% threshold, no verification run; WARNING: Sharpe=52.39>5.0 (consistent BTC/15m sniper pattern); KEEP as new BTC/15m best	-	714488.04	42.62	0.1775	62509	0.6629	0.7357	0.175324
124	2026-03-25T14:00:00Z	XRP	15m	DISCARD	0.221407	0.0284	295.10	142.8	XRP/15m anti-starvation n_estimators=[100,800] (strategy priority #4 from strategy after iter 119) -- n_estimators=[100,800] already in knobs.json; 20/40 HPO trials (starvation STILL present -- worse than iter 119 22/40); Brier=0.221407 regressed vs best 0.218727 (+1.23124	2026-03-25T14:00:00Z	XRP	15m	DISCARD	0.221407	0.0284	295.10	142.8	XRP/15m anti-starvation n_estimators=[100,800] (strategy priority #4 from strategy after iter 119) -- n_estimators=[100,800] already in knobs.json; 20/40 HPO trials (starvation STILL present -- worse than iter 119 22/40); Brier=0.221407 regressed vs best 0.218727 (+1.23%); best_params: n_estimators=658 (near ceiling -- XRP/15m prefers high n_estimators like BTC/5m); lr=0.047, max_depth=6, num_leaves=106, min_child=557, reg_alpha=1.5e-5, reg_lambda=0.028; n_estimators=658 near ceiling with num_leaves=106 (high complexity per trial) drives starvation; XRP/15m dataset=309K samples (large, consistent with BTC/5m starvation pattern); tick-dominant FLAT pattern: WR=50.63%; top features: partial_bar_position, distance_from_open, partial_range, volume_sma_10, rsi_14, bar_position, body_ratio, rsi_7, vol_ratio, macd_histogram; FAIL: Brier 0.221407 > best 0.218727; anti-starvation fix insufficient for XRP/15m -- large dataset structural starvation; hpo_objective=0.498 elevated; WARNING: Sharpe=142.8>5.0	-	23607414.29	142.8	0.075	77376	0.5063	0.6416	0.497825

