iteration	timestamp	asset	timeframe	status	oos_brier	oos_ece	backtest_pnl	backtest_sharpe	description	commit	bs_pnl	bs_sharpe	backtest_max_dd	backtest_trades	backtest_win_rate	oos_accuracy	hpo_objective
83	2026-03-21T19:30:00	BTC	1h	VALIDATION-PASS	0.1014	-	-	31.68	BTC 1h CPCV VALIDATION (autonomous, auditor advisory note 1: "1h CPCV is next priority") — C(8,2)=28 paths, n_groups=8, k_test=2, saved model.lgb params (lr=0.0863, depth=5, n_est=624); PBO(Sharpe)=0.3929 PASS (GENUINE — first non-ETH-5m genuine PBO pass, no ruling needed), PBO(Brier)=0.8214 (same Brier paradox), PBO(best-of-both)=0.3929 PASS; Deflated Sharpe=33.6247 PASS; IS Sharpe mean=76.53 std=1.27; OOS Sharpe mean=31.68 std=1.46 (100pct paths positive, 28/28); OOS Brier mean=0.1014 std=0.0024 PASS (std<0.01); IS-OOS Sharpe corr=-0.2106 (weakly negative — between regime seesaw and random ranking, in "genuine signal" zone like ETH 5m corr=-0.33); IS-OOS absolute gap=58.6pct (large but PBO passes directly); COMPOSITE GATE: PBO PASS + all criteria PASS; VERDICT: VALIDATION-PASS — BTC 1h cleared for deployment; KEY FINDING: BTC 1h is the SECOND genuine PBO pass (after ETH 5m PBO=0.1786); IS-OOS corr=-0.2106 is milder than BTC 5m/15m regime seesaw (-0.70 to -0.90) — 1h bar aggregation smooths regime concentration; next: ETH 1h CPCV	-	-	-	-	-	-	-	-
84	2026-03-21T20:30:00	ETH	1h	VALIDATION-PASS	0.1890	-	-	72.58	ETH 1h CPCV VALIDATION (strategy priority [1h-cpcv-2]) — C(8,2)=28 paths, n_groups=8, k_test=2, saved model.lgb params (lr=0.0863, depth=5, n_est=624); PBO(Sharpe)=0.9286 FAIL (PBO gate SUSPENDED per auditor Ruling 1: IS-OOS corr=-0.8567 < -0.50), PBO(Brier)=1.0000 (same Brier paradox), PBO(best-of-both)=0.9286; Deflated Sharpe=75.2844 PASS; IS Sharpe mean=78.68 std=0.77; OOS Sharpe mean=72.58 std=2.06 (100pct paths positive, 28/28); OOS Brier mean=0.1890 std=0.0039 PASS (std<0.01); IS-OOS Sharpe corr=-0.8567 SEVERE (UNEXPECTED: ETH is tick-dominant at 5m/15m but BTC-class regime seesaw at 1h); IS-OOS absolute gap=7.75pct PASS (<20pct); COMPOSITE GATE: ALL 4 PASS (100pct positive paths, IS-OOS gap 7.75pct, Deflated Sharpe 75.28, OOS Brier std 0.0039); VERDICT: VALIDATION-PASS CONDITIONAL — ETH 1h cleared for deployment via Ruling 1; KEY FINDING: ETH transitions from tick-dominant (5m corr=-0.33, 15m corr=+0.0009) to regime-seesaw (1h corr=-0.8567) — 1h bar aggregation amplifies regime sensitivity that is masked at shorter timeframes; cross-timeframe IS-OOS corr pattern: ETH 5m -0.33 (genuine), ETH 15m +0.00 (Ruling 2), ETH 1h -0.86 (Ruling 1); next: SOL 1h CPCV	-	-	-	-	-	-	-	-
85	2026-03-21T21:30:00	SOL	1h	VALIDATION-PASS	0.1982	-	-	71.37	SOL 1h CPCV VALIDATION (strategy priority [1h-cpcv-3]) — C(8,2)=28 paths, n_groups=8, k_test=2, saved model.lgb params (lr=0.0863, depth=5, n_est=624); PBO(Sharpe)=1.0000 FAIL (PBO gate SUSPENDED per auditor Ruling 1: IS-OOS corr=-0.7318 < -0.50), PBO(Brier)=1.0000 (same Brier paradox), PBO(best-of-both)=1.0000; Deflated Sharpe=72.2241 PASS; IS Sharpe mean=75.73 std=0.48; OOS Sharpe mean=71.37 std=0.82 (100pct paths positive, 28/28); OOS Brier mean=0.1982 std=0.0040 PASS (std<0.01); IS-OOS Sharpe corr=-0.7318 SEVERE (UNEXPECTED: SOL is tick-dominant at 5m/15m but regime-seesaw at 1h — SAME pattern as ETH iter 84); IS-OOS absolute gap=5.76pct PASS (<20pct); COMPOSITE GATE: ALL 4 PASS (100pct positive paths, IS-OOS gap 5.76pct, Deflated Sharpe 72.22, OOS Brier std 0.0040); VERDICT: VALIDATION-PASS CONDITIONAL — SOL 1h cleared for deployment via Ruling 1; KEY FINDING: SOL transitions from tick-dominant (15m corr=+0.0104 Ruling 2) to regime-seesaw at 1h (corr=-0.7318 Ruling 1) — identical to ETH transition (15m corr=+0.0009 to 1h corr=-0.8567); 2/2 tick-dominant assets confirm 1h bar aggregation amplifies regime sensitivity; cross-timeframe IS-OOS corr pattern: SOL 5m --(R1) SOL 15m +0.0104(R2) SOL 1h -0.7318(R1); next: XRP 1h CPCV	-	-	-	-	-	-	-	-
86	2026-03-20T12:23:17	XRP	1h	VALIDATION-PASS	0.2043	-	-	69.98	XRP 1h CPCV VALIDATION (strategy priority [1h-cpcv-4] � THE FINAL CPCV) � C(8,2)=28 paths, n_groups=8, k_test=2, saved model.lgb params (lr=0.0120, depth=5, n_est=705); PBO(Sharpe)=0.8214 FAIL (PBO gate SUSPENDED per auditor Ruling 1: IS-OOS corr=-0.5599 < -0.50), PBO(Brier)=1.0000 (same Brier paradox), PBO(best-of-both)=0.8214; Deflated Sharpe=72.5943 PASS; IS Sharpe mean=70.65 std=0.88; OOS Sharpe mean=69.98 std=1.74 (100pct paths positive, 28/28); OOS Brier mean=0.2043 std=0.0073 PASS (std<0.01); IS-OOS Sharpe corr=-0.5599 (regime seesaw � XRP BTC-class confirmed at 1h, corr smooths from 5m -0.90 to 15m -0.80 to 1h -0.56 but stays in Ruling 1 territory); IS-OOS absolute gap=0.95pct PASS (<20pct); COMPOSITE GATE: ALL 4 PASS (100pct positive paths, IS-OOS gap 0.95pct, Deflated Sharpe 72.59, OOS Brier std 0.0073); VERDICT: VALIDATION-PASS CONDITIONAL � XRP 1h cleared for deployment via Ruling 1; PROGRAM MILESTONE: ALL 12 CPCV VALIDATIONS COMPLETE (4 assets x 3 timeframes); 1h CPCV final status: BTC GENUINE PASS (PBO=0.3929), ETH Ruling 1 (PBO=0.9286), SOL Ruling 1 (PBO=1.0000), XRP Ruling 1 (PBO=0.8214); cross-timeframe IS-OOS corr pattern XRP: 5m -0.9047(R1) 15m -0.8010(R1) 1h -0.5599(R1) � XRP is the ONLY asset with Ruling 1 at all 3 timeframes	-	-	-	-	-	-	-	-
87	2026-03-21T23:00:00	XRP	15m	VALIDATION-PASS	0.193412	0.0322	59.20	145.41	XRP 15m REGIME-BUCKETED OOS DIAGNOSTIC (auditor pending flag, autonomous) — XRP-optimal config (train_bars=10000, purge_period=24, n_splits=8), verify mode 100 trials 600s timeout, 48 HPO trials ran; Brier 0.193412 noise-level regression from iter 74 best 0.192624 (0.4%); REGIME-BUCKETED RESULTS: low(n=6759,43.7%): Sharpe=140.42 Brier=0.1966 WR=50.2% PASS; normal(n=7005,45.3%): Sharpe=147.02 Brier=0.1878 WR=52.0% PASS; high(n=874,5.6%): Sharpe=142.96 Brier=0.1898 WR=51.0% PASS; crisis(n=838,5.4%): Sharpe=144.78 Brier=0.1765 WR=52.0% PASS; ALL 4 BUCKETS POSITIVE — XRP 15m FULL DEPLOYMENT CLEARANCE; KEY INSIGHT: XRP 15m Sharpe FLAT across regimes (140-147, 4.7% spread) — tick-dominant pattern confirmed (same as SOL 5m iter 56 flat spread 235-247); crisis bucket BEST Brier (0.1765) — calibration improves with volatility; tick-dominant SHAP unchanged (partial_bar_position, partial_range, volume_ratio_partial, distance_from_open, trade_intensity — regime_vol_zscore absent); best_params: lr=0.052, max_depth=6, num_leaves=72, reg_alpha=7.3e-4, reg_lambda=0.0; reg_alpha anomaly fully resolved (iter 74 collapsed 2.854->1e-6, iter 87 confirms ~0); COMPLETE REGIME VALIDATION: 5/5 assets-timeframes validated (BTC 5m, SOL 5m, ETH 15m, SOL 15m, XRP 15m) — all FULL PASS	-	4738642.86	146.27	0.015	15248	0.5134	0.7106	0.296872
88	2026-03-22T01:00:00	BTC	1h	KEEP	0.096672	0.0284	3.98	33.44	BTC 1h REGIME-BUCKETED OOS DIAGNOSTIC (strategy priority [MTF-2]) — BTC-optimal config (train_bars=10000, purge_period=24, n_splits=8), verify mode 100 trials 600s timeout, 100 HPO trials ran; Brier 0.096672 improvement over iter 68 best 0.098481 (1.84%); REGIME-BUCKETED RESULTS: low(n=1567,40.5%): Sharpe=75.87 Brier=0.0697 WR=91.5% PASS; normal(n=1802,46.5%): Sharpe=91.27 Brier=0.0761 WR=94.8% PASS; high(n=303,7.8%): Sharpe=116.88 Brier=0.0638 WR=96.9% PASS; crisis(n=202,5.2%): Sharpe=158.43 Brier=0.0515 WR=98.5% PASS; ALL 4 BUCKETS POSITIVE — BTC 1h FULL DEPLOYMENT CLEARANCE; KEY INSIGHT: BTC 1h monotonic pattern CONFIRMED (same as BTC 5m iter 55): Sharpe increases low(76)<normal(91)<high(117)<crisis(158) and Brier improves low(0.070)>high(0.064)>crisis(0.052); edge monotonically increases with volatility; crisis bucket BEST (Sharpe 158.43, Brier 0.0515); 6/6 regime-bucketed validations now complete (BTC 5m, SOL 5m, ETH 15m, SOL 15m, XRP 15m, BTC 1h)	-	47658.33	24.59	0.0389	3668	0.8569	0.865	0.09690489
89	2026-03-22T02:10:00	ETH	1h	KEEP	0.176103	0.0364	14.74	71.58	ETH 1h REGIME-BUCKETED OOS DIAGNOSTIC (strategy priority [MTF-2], ETH 1h second) — ETH-optimal config (train_bars=10000, purge_period=24, n_splits=8), verify mode 100 trials 600s timeout, 100 HPO trials ran; Brier 0.176103 improvement over iter 69 best 0.177509 (0.79%); REGIME-BUCKETED RESULTS: low(n=1575,40.7%): Sharpe=71.57 Brier=0.1626 WR=50.7% PASS; normal(n=1805,46.6%): Sharpe=72.13 Brier=0.1633 WR=51.0% PASS; high(n=284,7.3%): Sharpe=60.65 Brier=0.1516 WR=44.7% PASS; crisis(n=210,5.4%): Sharpe=73.82 Brier=0.1462 WR=51.9% PASS; ALL 4 BUCKETS POSITIVE — ETH 1h FULL DEPLOYMENT CLEARANCE; KEY INSIGHT: ETH 1h FLAT pattern (Sharpe 61-74, 21% spread) — narrower than BTC 1h monotonic (76-158); crisis bucket BEST Brier (0.1462) same as BTC pattern; 7/9 regime-bucketed validations complete (BTC 5m, SOL 5m, ETH 15m, SOL 15m, XRP 15m, BTC 1h, ETH 1h); top features: partial_bar_position, partial_range, volume_ratio_partial, trade_intensity, bar_position, rsi_7; best_params: lr=0.014, max_depth=4, num_leaves=74, reg_alpha=0.024, reg_lambda=9.42	-	1187014.29	78.42	0.015	3856	0.5075	0.7359	0.188235
90	2026-03-22T03:20:00	SOL	1h	KEEP	0.193886	0.0344	14.16	71.21	SOL 1h REGIME-BUCKETED OOS DIAGNOSTIC (strategy priority [MTF-2], 8/9) — SOL-optimal config (train_bars=10000, purge_period=24, n_splits=8), verify mode 100 trials 600s timeout, 100 HPO trials ran; Brier 0.193886 improvement over iter 70 best 0.19504 (0.59%); REGIME-BUCKETED RESULTS: low(n=1563,40.4%): Sharpe=68.94 Brier=0.1658 WR=49.3% PASS; normal(n=1808,46.7%): Sharpe=67.33 Brier=0.1676 WR=48.5% PASS; high(n=271,7.0%): Sharpe=70.54 Brier=0.1573 WR=50.2% PASS; crisis(n=227,5.9%): Sharpe=76.55 Brier=0.1528 WR=53.3% PASS; ALL 4 BUCKETS POSITIVE — SOL 1h FULL DEPLOYMENT CLEARANCE; KEY INSIGHT: SOL 1h FLAT pattern (Sharpe 67-77, 15% spread) — similar to ETH 1h (61-74), tick-dominant confirmed; crisis bucket BEST Brier (0.1528) same monotonic improvement with volatility; 8/9 regime-bucketed validations complete (BTC 5m, SOL 5m, ETH 15m, SOL 15m, XRP 15m, BTC 1h, ETH 1h, SOL 1h); top features: partial_bar_position, partial_range, trade_intensity, distance_from_open, volume_ratio_partial, macd_histogram, bar_position; best_params: lr=0.059, max_depth=6, num_leaves=98, reg_alpha=0.212, reg_lambda=0.0	-	1132328.57	71.13	0.0175	3727	0.5068	0.7041	0.190444
91	2026-03-22T04:30:00	XRP	1h	VALIDATION-PASS	0.195802	0.0304	15.08	73.63	XRP 1h REGIME-BUCKETED OOS DIAGNOSTIC (strategy priority [MTF-2], 9/9 — THE FINAL REGIME VALIDATION) — XRP-optimal config (train_bars=10000, purge_period=24, n_splits=8), verify mode 100 trials 600s timeout, 100 HPO trials ran; Brier 0.195802 noise-level regression from iter 71 best 0.194578 (0.63%); REGIME-BUCKETED RESULTS: low(n=1645,42.5%): Sharpe=81.75 Brier=0.1831 WR=56.8% PASS; normal(n=1732,44.8%): Sharpe=79.33 Brier=0.1776 WR=56.3% PASS; high(n=294,7.6%): Sharpe=82.36 Brier=0.1847 WR=57.2% PASS; crisis(n=198,5.1%): Sharpe=75.96 Brier=0.1520 WR=58.8% PASS; ALL 4 BUCKETS POSITIVE — XRP 1h FULL DEPLOYMENT CLEARANCE; KEY INSIGHT: XRP 1h FLAT Sharpe pattern (76-82, 8% spread) — BTC-class asset shows narrower spread than BTC 1h (76-158 monotonic), more like ETH/SOL tick-dominant pattern at 1h despite being regime-seesaw in CPCV (IS-OOS corr=-0.5599); crisis bucket BEST Brier (0.1520) — same volatility-improvement pattern as all other assets; PROGRAM MILESTONE: ALL 9/9 REGIME-BUCKETED VALIDATIONS COMPLETE (BTC 5m, SOL 5m, ETH 15m, SOL 15m, XRP 15m, BTC 1h, ETH 1h, SOL 1h, XRP 1h); top features: partial_bar_position, volume_ratio_partial, partial_range, distance_from_open, trade_intensity, bar_position, rsi_7; best_params: lr=0.057, max_depth=4, num_leaves=23, reg_alpha=3.9e-4, reg_lambda=0.0	-	1205828.57	73.70	0.0125	3840	0.5258	0.7038	0.19992692
92	2026-03-22T17:00:00	BTC	5m	KEEP	0.177295	0.0187	48.01	64.77	BTC/5m multi-tp revalidation (OVERRIDE item 2) — time_pcts=[0.10,0.20,0.40,0.60,0.80] multi-point training, 5 samples/bar, TimeAwareCalibrator per-bucket; overall Brier=0.177295 (multi-tp avg across all time points, increase expected vs single-point 0.101759); ECE=0.0187 PASS; time-bucket win_rates: t10=42.4%, t20=48.5%, t40=68.8%, t80=82.7%; t80 bucket shows BTC sniper pattern (82.7% WR) consistent with pre-multi-tp; model saved to data/models/pulse_v2/BTC_5m; HPO 22/40 trials (fast mode); top features: vol_norm_distance, distance_from_open, elapsed_pct, time_remaining_pct, partial_bar_position, regime_vol_zscore; KEEP as new multi-tp BTC/5m baseline; OVERRIDE status: 2/12 complete (ETH/5m + BTC/5m)	ae42530c	1386270.94	43.07	0.3356	80940	0.6053	0.7254	0.168151
93	2026-03-22T17:30:00Z	SOL	5m	KEEP	0.218209	0.0083	299.57	239.12	SOL/5m multi-tp revalidation (OVERRIDE item 3) -- time_pcts=[0.10,0.20,0.40,0.60,0.80] multi-point training, 5 samples/bar, TimeAwareCalibrator per-bucket; overall Brier=0.218209 (multi-tp avg across all time points, increase expected vs single-point 0.189372); ECE=0.0083 PASS; t=0.80 bucket (180-295s) WR=49.9% -- tick-dominant pattern (flat across time buckets, no sniper ramp); model saved to data/models/pulse_v2/SOL_5m; HPO 18/40 trials (fast mode); top features: partial_bar_position, partial_range, trade_intensity, elapsed_pct, time_remaining_pct, parkinson_vol_10, volume_ratio_partial, distance_from_open; KEEP as new multi-tp SOL/5m baseline; OVERRIDE status: 3/12 complete (ETH/5m + BTC/5m + SOL/5m)	89f0d97	68243514.29	241.04	0.0688	80785	0.4933	0.6445	0.455562
94	2026-03-22T18:10:00Z	XRP	5m	KEEP	0.221782	0.0157	301.38	241.9	XRP/5m multi-tp revalidation (OVERRIDE item 3, 4/12 overall) -- time_pcts=[0.10,0.20,0.40,0.60,0.80] multi-point training, 5 samples/bar, TimeAwareCalibrator per-bucket; overall Brier=0.221782 (multi-tp avg across all time points, increase expected vs single-point 0.195309); ECE=0.0157 PASS; t=0.80 bucket (180-295s) WR=49.98% -- XRP tick-dominant flat pattern (consistent win_rate across all time buckets: t1=49.8%, t2=49.8%, t3=49.8%, t4=50.0%); model saved to data/models/pulse_v2/XRP_5m; HPO 24/40 trials (fast mode); top features: partial_bar_position, partial_range, distance_from_open, time_remaining_pct, elapsed_pct, rsi_14, volume_ratio_partial, volume_sma_10, trade_intensity, rsi_7; best_params: lr=0.045, max_depth=5, num_leaves=19, reg_alpha=0.0, reg_lambda=2e-6; KEEP as new multi-tp XRP/5m baseline; OVERRIDE status: 4/12 complete (ETH/5m + BTC/5m + SOL/5m + XRP/5m); all 5m models done, next: BTC/15m	-	69290214.29	242.58	0.0688	80785	0.4977	0.6375	0.4623995
95	2026-03-22T18:30:00	BTC	15m	KEEP	0.171913	0.0122	50.05	51.78	BTC/15m multi-tp revalidation (OVERRIDE item 5, 5/12 overall) -- time_pcts=[0.10,0.20,0.40,0.60,0.80] multi-point training; overall Brier=0.171913 (multi-tp avg, increase expected vs single-point 0.094003); ECE=0.0122 PASS; time-bucket WRs: t10-20(60-120s)=53.2%, t80(180-295s)=60.3%; model saved to data/models/pulse_v2/BTC_15m; HPO 18/40 trials (fast mode); top features: vol_norm_distance, distance_from_open, elapsed_pct, time_remaining_pct, partial_bar_position; best_params: lr=0.021, max_depth=6, num_leaves=43; KEEP as new multi-tp BTC/15m baseline; OVERRIDE status: 5/12 complete; next: ETH/15m	-	713930.26	41.04	0.174	62269	0.6584	0.7356	0.175251
96	2026-03-22T19:30:00Z	ETH	15m	KEEP	0.209819	0.0278	291.99	141.98	ETH/15m multi-tp revalidation (OVERRIDE item 6, 6/12 overall) -- time_pcts=[0.10,0.20,0.40,0.60,0.80] multi-point training, 5 samples/bar, TimeAwareCalibrator per-bucket; overall Brier=0.209819 (multi-tp avg, increase expected vs single-point 0.174283); ECE=0.0278 PASS; t=0.80 (180-295s) WR=50.1% -- ETH tick-dominant flat pattern consistent across time buckets; model saved to data/models/pulse_v2/ETH_15m; train_bars=14000 (ETH-optimal); HPO 19/40 trials (fast mode); top features: partial_bar_position, partial_range, time_remaining_pct, elapsed_pct, bar_position, rsi_7, parkinson_vol_10, distance_from_open; best_params: lr=0.018, max_depth=6, num_leaves=52, reg_alpha=0.066; KEEP as new multi-tp ETH/15m baseline; OVERRIDE status: 6/12 complete (ETH/5m+BTC/5m+SOL/5m+XRP/5m+BTC/15m+ETH/15m); next: SOL/15m	-	23346985.71	141.82	0.0862	76521	0.5011	0.6697	0.295422
97	2026-03-22T20:30:00Z	SOL	15m	KEEP	0.215443	0.0115	288.8	143.09	SOL/15m multi-tp revalidation (OVERRIDE item 7, 7/12 overall) -- time_pcts=[0.10,0.20,0.40,0.60,0.80] multi-point training, 5 samples/bar, TimeAwareCalibrator per-bucket; overall Brier=0.215443 (multi-tp avg, increase expected vs single-point 0.186836); ECE=0.0115 PASS; time-bucket WRs: t20(60-120s)=49.81%, t80(180-295s)=49.81% -- SOL tick-dominant FLAT pattern confirmed (identical WR across buckets); model saved to data/models/pulse_v2/SOL_15m; train_bars=10000 purge_period=12 (SOL-optimal); HPO 16/40 trials (fast mode); top features: partial_bar_position, partial_range, bar_position, volume_sma_10, rsi_7, regime_vol_zscore, vol_ratio, distance_from_open, macd_histogram, parkinson_vol_10; best_params: lr=0.018, max_depth=6, num_leaves=59, reg_alpha=4.2e-4, reg_lambda=0.0; KEEP as new multi-tp SOL/15m baseline; OVERRIDE status: 7/12 complete (ETH/5m+BTC/5m+SOL/5m+XRP/5m+BTC/15m+ETH/15m+SOL/15m); next: XRP/15m	-	23061542.86	142.33	0.0587	75450	0.4981	0.654	0.36417898
98	2026-03-22T21:15:00Z	XRP	15m	KEEP	0.218727	0.0156	295.19	142.91	XRP/15m multi-tp revalidation (OVERRIDE item 8, 8/12 overall) -- time_pcts=[0.10,0.20,0.40,0.60,0.80] multi-point training, 5 samples/bar, TimeAwareCalibrator per-bucket; overall Brier=0.218727 (multi-tp avg, increase expected vs single-point 0.192624, +13.6% -- tick-dominant XRP pattern consistent with ETH/SOL/XRP 5m +14-20% range); ECE=0.0156 PASS; time-bucket WRs: t20(60-120s)=50.63%, t80(180-295s)=50.64% -- XRP tick-dominant FLAT pattern confirmed; model saved to data/models/pulse_v2/XRP_15m; train_bars=10000 purge_period=24 n_splits=8 (XRP-optimal); HPO 24/40 trials (fast mode); top features: partial_bar_position, partial_range, time_remaining_pct, distance_from_open, elapsed_pct, volume_ratio_partial, rsi_14, rsi_7, volume_sma_10, bar_position; best_params: lr=0.025, max_depth=5, num_leaves=42, reg_alpha=0.0, reg_lambda=0.058; KEEP as new multi-tp XRP/15m baseline; OVERRIDE status: 8/12 complete (ETH/5m+BTC/5m+SOL/5m+XRP/5m+BTC/15m+ETH/15m+SOL/15m+XRP/15m); all 5m+15m models done; next: BTC/1h	-	23612385.71	143.49	0.075	77369	0.5063	0.6481	0.498404
99	2026-03-22T22:30:00Z	BTC	1h	KEEP	0.175668	0.0133	11.88	21.98	BTC/1h multi-tp revalidation (OVERRIDE item 9, 9/12 overall) -- time_pcts=[0.10,0.20,0.40,0.60,0.80] multi-point training, 5 samples/bar, TimeAwareCalibrator per-bucket; overall Brier=0.175668 (multi-tp avg, increase expected vs single-point 0.096672, +82% -- BTC sniper pattern, consistent with BTC/5m +74% BTC/15m +83%); ECE=0.0133 PASS; overall backtest WR=62.38% -- BTC sniper pattern confirmed (elevated WR consistent with prior BTC runs); model saved to data/models/pulse_v2/BTC_1h; train_bars=10000 purge_period=24 n_splits=8 (BTC-optimal); HPO 27/40 trials (fast mode, starvation expected); top features: distance_from_open, vol_norm_distance, elapsed_pct, time_remaining_pct, partial_bar_position, trade_intensity, rsi_7, volume_sma_10, body_ratio, bar_position; best_params: lr=0.009, max_depth=5, num_leaves=51, reg_alpha=3.9e-05, reg_lambda=0.015; KEEP as new multi-tp BTC/1h baseline; OVERRIDE status: 9/12 complete (ETH/5m+BTC/5m+SOL/5m+XRP/5m+BTC/15m+ETH/15m+SOL/15m+XRP/15m+BTC/1h); next: ETH/1h	-	167602.4	15.7	0.2216	16257	0.6238	0.7233	0.175654
100	2026-03-22T23:30:00Z	ETH	1h	KEEP	0.211438	0.0159	73.64	71.46	ETH/1h multi-tp revalidation (OVERRIDE item 10, 10/12 overall) -- time_pcts=[0.10,0.20,0.40,0.60,0.80] multi-point training, 5 samples/bar, TimeAwareCalibrator per-bucket; overall Brier=0.211438 (multi-tp avg, increase expected vs single-point 0.176103, +20.1% -- ETH tick-dominant flat pattern, consistent with ETH/15m +20% and ETH/5m); ECE=0.0159 PASS; overall backtest WR=50.49% -- ETH tick-dominant FLAT pattern confirmed (consistent with prior ETH runs); model saved to data/models/pulse_v2/ETH_1h; train_bars=10000 purge_period=24 n_splits=8 (ETH-optimal); HPO 40/40 trials (fast mode, full search); top features: partial_bar_position, partial_range, elapsed_pct, time_remaining_pct, bar_position, rsi_14, rsi_7, volume_sma_10, volume_ratio_partial, distance_from_open; best_params: lr=0.010, max_depth=4, num_leaves=26, reg_alpha=0.146, reg_lambda=3e-06; KEEP as new multi-tp ETH/1h baseline; OVERRIDE status: 10/12 complete (ETH/5m+BTC/5m+SOL/5m+XRP/5m+BTC/15m+ETH/15m+SOL/15m+XRP/15m+BTC/1h+ETH/1h); next: SOL/1h	-	5891800.0	71.42	0.075	19286	0.5049	0.6622	0.395549
101	2026-03-22T23:55:00Z	SOL	1h	KEEP	0.221683	0.0153	70.9	69.2	SOL/1h multi-tp revalidation (OVERRIDE item 11, 11/12 overall) -- time_pcts=[0.10,0.20,0.40,0.60,0.80] multi-point training, 5 samples/bar, TimeAwareCalibrator per-bucket; overall Brier=0.221683 (multi-tp avg, increase expected vs single-point 0.193886, +14.3101 2026-03-22T23:55:00Z SOL 1h KEEP 0.221683 0.0153 70.9 69.2 SOL/1h multi-tp revalidation (OVERRIDE item 11, 11/12 overall) -- time_pcts=[0.10,0.20,0.40,0.60,0.80] multi-point training, 5 samples/bar, TimeAwareCalibrator per-bucket; overall Brier=0.221683 (multi-tp avg, increase expected vs single-point 0.193886, +14.3% -- SOL tick-dominant pattern, consistent with SOL/5m +15% SOL/15m +15%); ECE=0.0153 PASS; overall backtest WR=49.24% -- SOL tick-dominant FLAT pattern confirmed; model saved to data/models/pulse_v2/SOL_1h; train_bars=10000 purge_period=24 n_splits=8 (SOL-optimal); HPO 40/40 trials; top features: partial_bar_position, partial_range, volume_sma_10, bar_position, rsi_7; best_params: lr=0.017, max_depth=5, num_leaves=32; KEEP as new multi-tp SOL/1h baseline; OVERRIDE status: 11/12 complete; next: XRP/1h (FINAL)	-	5676242.86	69.04	0.085	19345	0.4924	0.6424	0.406395
