iteration	timestamp	asset	timeframe	status	oos_brier	oos_ece	backtest_pnl	backtest_sharpe	description	commit	bs_pnl	bs_sharpe	backtest_max_dd	backtest_trades	backtest_win_rate	oos_accuracy	hpo_objective
125	2026-03-25T15:00:00Z	SOL	1h	KEEP	0.220615	0.0187	70.81	69.29	SOL/1h reg_alpha widen to [0.1,20.0] (strategy priority #5 from strategy after iter 119) -- widen reg_alpha from [1e-8,10.0] to [0.1,20.0] to test if true optimum is above 10.0 (iter 118 found reg_alpha=8.55 near ceiling); 40/40 HPO trials (no starvation, 241s); Brier=0.220615 improvement from iter 101 best 0.221683 (0.048125	2026-03-25T15:00:00Z	SOL	1h	KEEP	0.220615	0.0187	70.81	69.29	SOL/1h reg_alpha widen to [0.1,20.0] (strategy priority #5 from strategy after iter 119) -- widen reg_alpha from [1e-8,10.0] to [0.1,20.0] to test if true optimum is ~0.9, upper bound not binding; 40/40 HPO trials no starvation 241s; Brier=0.220615 improvement from iter 101 best 0.221683 (0.048%); best_params: n_estimators=249 lr=0.051 max_depth=6 num_leaves=33 min_child=834 reg_alpha=0.919 NOT near ceiling; KEY FINDING: reg_alpha optimum ~0.9 NOT above 10.0 as iter 118 artifact suggested; n_estimators=249 within ceiling; tick-dominant FLAT: WR=49.21%; top features: partial_bar_position partial_range bar_position rsi_7 volume_sma_10; PASS: Brier 0.220615 < best 0.221683; WARNING: Sharpe=69.29>5.0 consistent SOL/1h pattern; KEEP as new SOL/1h best	-	5658057.14	69.32	0.0838	18956	0.4921	0.6433	0.40446

126	2026-03-25T17:00:00Z	SOL	15m	DISCARD	0.216386	0.009	288.56	142.34	SOL/15m anti-starvation n_estimators=[100,800] (strategy priority #1 from strategy after iter 125) -- knobs.json already had [100,800]; 16/40 HPO trials (starvation PERSISTS -- same as iters 97 and 109); Brier=0.216386 regressed vs best 0.215443 (+0.436%); best_params: n_estimators=692 (near 800 ceiling -- SAME structural starvation as BTC/5m and XRP/15m); lr=0.051, max_depth=6, num_leaves=49, min_child=469, reg_alpha=0.871; n_estimators=692 near ceiling with 16/40 trials confirms SOL/15m has BTC/5m-class large-dataset starvation (309K samples/8 folds = ~38K samples/fold is enough but high complexity per trial drives starvation); tick-dominant FLAT: WR=49.82%; top features: partial_bar_position, partial_range, bar_position, volume_sma_10, vol_ratio, rsi_7, macd_histogram, regime_vol_zscore, parkinson_vol_10, body_ratio; FAIL: Brier 0.216386 > best 0.215443; anti-starvation 800 ceiling insufficient for SOL/15m -- structural starvation persists; next step: further ceiling reduction to [100,600] similar to XRP/15m item 3; hpo_objective=0.366; WARNING: Sharpe=142.34>5.0 consistent SOL tick-dominant pattern	-	23066885.71	142.02	0.06	74560	0.4982	0.6499	0.366033
127	2026-03-25T18:00:00Z	BTC	5m	DISCARD	0.176292	0.008	54.46	75.39	BTC/5m n_splits=6 experiment -- auditor conditional unlock after items 3-6 complete; reduced walk_forward.n_splits from 8 to 6 plus n_estimators=[100,800]; 31/40 HPO trials (major improvement from 22/40 at iter 122 -- starvation mostly resolved); Brier=0.176292 regressed vs best 0.17605 (+0.135%); KEY FINDING: n_estimators=184 well within 800 ceiling NOT near bound for first time -- n_splits=6 resolved ceiling pressure but no Brier improvement; best_params: n_estimators=184 lr=0.0998 max_depth=5 num_leaves=40 min_child=854 reg_alpha=0.0; BTC sniper RAMP: t30-60=WR50.7% t60-120=WR56.4% t120-180=WR72.5% t180-295=WR83.1%; top features: vol_norm_distance distance_from_open time_remaining_pct elapsed_pct trade_intensity; FAIL: Brier 0.176292 > best 0.17605; DISCARD -- revert n_splits to 8; WARNING: Sharpe=75.39>5.0 consistent BTC sniper pattern	-	1683950.25	60.36	0.3326	80940	0.6517	0.7262	0.168269

128	2026-03-25T19:00:00Z	XRP	15m	KEEP	0.218075	0.012	295.53	143.93	XRP/15m further ceiling reduction n_estimators=[100,600] (strategy priority #3 from strategy after iter 125) -- reduced n_estimators ceiling from 1500 to 600 to force lower-n_estimators exploration; 20/40 HPO trials (starvation PERSISTS -- n_estimators=599 at new 600 ceiling); Brier=0.218075 improvement from iter 98 best 0.218727 (0.298% improvement); best_params: n_estimators=599 (near ceiling -- XRP/15m structural starvation persists even at 600 ceiling), lr=0.006, max_depth=6, num_leaves=128, min_child=499, reg_alpha=5.8e-05; KEY FINDING: ceiling reduction from 800 to 600 did NOT resolve starvation (599 at ceiling); XRP/15m prefers high n_estimators like BTC/5m, confirming large-dataset structural constraint; tick-dominant FLAT: WR=50.63%; top features: partial_bar_position, partial_range, elapsed_pct, time_remaining_pct, distance_from_open, volume_ratio_partial, rsi_14, rsi_7, bar_position, volume_sma_10; train_bars=10000 purge_period=24 n_splits=8; improvement 0.298% < 2% threshold, no verification run; PASS: Brier 0.218075 < best 0.218727; hpo_objective=0.498 elevated (consistent with starvation-driven suboptimal search); WARNING: Sharpe=143.93>5.0 consistent XRP/15m tick-dominant pattern; KEEP as new XRP/15m best (first improvement in multi-tp era)	-	23628514.29	143.87	0.075	76232	0.5063	0.6483	0.498416
129	2026-03-25T20:00:00Z	ETH	5m	DISCARD	0.212413	0.012	309.72	245.5	ETH/5m min_child narrowing [300,700] (strategy priority #4 from strategy after iter 125) -- narrowed min_child_samples from [100,1000] to [300,700] to test if constraint on min_child around 389 (iter 117 best_params) improves HPO efficiency; 16/40 HPO trials (STARVATION INTRODUCED -- narrowing worsened efficiency); n_estimators=790 near 800 ceiling (starvation from high num_leaves=121 plus min_child=[300,700] constraint); Brier=0.212413 regressed vs best 0.211888 (+0.25%); best_params: n_estimators=790 lr=0.020 max_depth=6 num_leaves=121 min_child=483 reg_alpha=3e-6 reg_lambda=0.008; tick-dominant ETH: WR=49.83%; top features: partial_bar_position partial_range elapsed_pct time_remaining_pct distance_from_open; KEY FINDING: min_child narrowing introduced starvation (16/40 trials) that did not exist at iter 117 (14000 train_bars); confirms audit note 3 -- range contraction has 0/6 KEEP rate; strategy queue items 1-4 COMPLETE (1-2 DISCARD, 3 KEEP, 4 DISCARD); FAIL: Brier 0.212413 > best 0.211888; WARNING: Sharpe=245.5>5.0 consistent ETH/5m tick-dominant pattern; hpo_objective=0.279 (starvation-elevated)	-	69688271.43	246.08	0.0687	81000	0.4983	0.6573	0.279431
130	2026-03-25T21:00:00Z	SOL	15m	KEEP	0.215345	0.0186	288.87	144.06	SOL/15m further ceiling reduction n_estimators=[100,600] (autonomous -- strategy queue after iter 125 fully complete) -- reduced ceiling from [100,800] to [100,600] following iter 126 starvation (16/40 trials at 800 ceiling) and XRP/15m iter 128 success (same fix, KEEP); 24/40 HPO trials (improved from 16/40 at 800 ceiling); n_estimators=154 well within 600 ceiling (NOT near bound for first time); Brier=0.215345 improvement from iter 97 best 0.215443 (0.046%); best_params: n_estimators=154 lr=0.069 max_depth=6 num_leaves=50 min_child=563 reg_alpha=7.8e-5 reg_lambda=0.0; KEY FINDING: ceiling reduction from 800 to 600 resolved starvation for SOL/15m (154 at ceiling vs 692 previously); tick-dominant SOL: WR=50.3%; top features: partial_bar_position partial_range elapsed_pct time_remaining_pct trade_intensity; train_bars=10000 purge_period=12 n_splits=8; improvement 0.046% < 2% threshold, no verification run; PASS: Brier 0.215345 < best 0.215443; hpo_objective=0.362 elevated (consistent with SOL/15m tick-dominant trade penalty); WARNING: Sharpe=144.06>5.0 consistent SOL/15m tick-dominant pattern; KEEP as new SOL/15m best (anti-starvation ceiling reduction works)	-	23051728.57	143.14	0.0537	75742	0.503	0.6542	0.362369
131	2026-03-25T22:00:00Z	BTC	1h	DISCARD	0.175773	0.0146	11.93	21.97	BTC/1h anti-starvation n_estimators=[100,600] + restore BTC/1h-optimal lr=[0.005,0.03] num_leaves=[32,96] train_bars=10000 (autonomous -- never received ceiling reduction fix); 32/40 HPO trials (major improvement from 13/40 at iter 107 -- starvation mostly resolved); n_estimators=569 near 600 ceiling (BTC/1h prefers high n_estimators like BTC/5m at 709 and XRP/15m at 599); Brier=0.175773 marginally regressed vs best 0.174864 (+0.053% marginal miss); best_params: n_estimators=569 lr=0.028 max_depth=6 num_leaves=96 min_child=636 reg_alpha=6.1e-4 reg_lambda=0.008; lr=0.028 near upper bound [0.005,0.03] -- lr ceiling slightly binding; BTC sniper WR=60.66%; top features: vol_norm_distance distance_from_open partial_bar_position elapsed_pct time_remaining_pct trade_intensity rsi_7 body_ratio bar_position vol_ratio; KEY FINDING: [100,600] ceiling resolved most starvation (32/40 trials vs 13/40) but BTC/1h genuine optimum may be near 570+ n_estimators (same large-dataset structural constraint as BTC/5m); FAIL: Brier 0.175773 > best 0.174864; WARNING: Sharpe=21.97>5.0 consistent BTC/1h sniper pattern; DISCARD -- restore best_knobs_BTC_1h.json	-	172671.49	15.35	0.2223	16445	0.6066	0.7228	0.175724
132	2026-03-26T02:30:00Z	XRP	15m	DISCARD	0.218115	0.011	295.56	143.79	XRP/15m further ceiling reduction n_estimators=[100,400] (strategy priority #1 from strategy after iter 131) -- reduced ceiling from [100,600] to [100,400] following iter 128 starvation (n_estimators=599 near 600 ceiling); 29/40 HPO trials (starvation partially persists -- was 22/40 at 800 ceiling, then likely ~29 at 600, now 29/40 at 400); n_estimators=138 well within 400 ceiling (NOT near bound -- starvation partially resolved compared to 599/600); Brier=0.218115 marginally regressed vs best 0.218075 (+0.018% marginal miss); best_params: n_estimators=138 lr=0.029 max_depth=6 num_leaves=79 min_child=896 reg_alpha=1e-6 reg_lambda=1e-5; tick-dominant XRP: WR=50.63%; top features: partial_bar_position partial_range time_remaining_pct elapsed_pct distance_from_open; KEY FINDING: n_estimators=138 not near 400 ceiling (confirming optimum is in 100-400 range) but 29/40 trials suggests mild remaining starvation (possibly from other HPO params); Brier miss is marginal (0.018%) -- stochastic tie; second attempt at 400 ceiling may confirm or flip; FAIL: Brier 0.218115 > best 0.218075 (0.018% miss, marginal stochastic tie); WARNING: Sharpe=143.79>5.0 consistent XRP/15m tick-dominant pattern; hpo_objective=0.498 still elevated (starvation proxy)	-	23634314.29	143.63	0.075	76582	0.5063	0.6481	0.498486
133	2026-03-26T03:30:00Z	BTC	1h	DISCARD	0.175108	0.0099	12.05	22.98	BTC/1h dual-binding fix n_estimators=[100,450] + lr=[0.005,0.05] (strategy priority #2 from strategy after iter 131) -- iter 131 found n_estimators=569/600 AND lr=0.028/0.03 both near ceiling simultaneously; this run: widened lr to [0.005,0.05] (RESOLVED: lr=0.021797 NOT near 0.05 ceiling) and further reduced n_estimators ceiling to [100,450] (PARTIAL: n_estimators=427 near 450 ceiling -- mild residual starvation); 38/40 HPO trials (improved from 32/40 at iter 131); Brier=0.175108 marginally regressed vs best 0.174864 (+0.0244% miss); best_params: n_estimators=427 lr=0.021797 max_depth=5 num_leaves=87 min_child=419 reg_alpha=4.07e-4 reg_lambda=5.2e-4; KEY FINDINGS: (1) lr constraint RESOLVED -- 0.021797 well within [0.005,0.05] ceiling; (2) n_estimators=427 near 450 ceiling -- mild residual starvation persists; next step: further reduce ceiling to [100,350]; BTC sniper WR=62.67%; top features: vol_norm_distance distance_from_open partial_bar_position elapsed_pct time_remaining_pct trade_intensity rsi_7 hour_cos bar_position volume_sma_10; FAIL: Brier 0.175108 > best 0.174864; WARNING: Sharpe=22.98>5.0 consistent BTC/1h sniper pattern	-	173652.79	17.32	0.2193	16337	0.6267	0.7254	0.175702
134	2026-03-26T05:00:00Z	BTC	5m	DISCARD	0.17608	0.0054	56.19	78.92	BTC/5m stochastic re-run n_estimators=[100,800] + lr=[0.005,0.1] (strategy priority #3 from strategy after iter 131) -- BTC/5m stagnant since iter 104 (0 improvements); this run: restored n_estimators=[100,800] (from [100,1500]) to reduce starvation and lr=[0.005,0.1] (global default); SEVERE STARVATION: only 17/40 HPO trials completed (worse than iter 122 which was also starved -- starvation intensified with 800 ceiling vs 1500); n_estimators=103 NEAR LOWER BOUND (100) -- very unusual: BTC/5m optimum appears to be ~100-103 in this run, contradicting previous finds of 709 (1500 ceiling) and 427 (450 ceiling); lr=0.057532 within [0.005,0.1] ceiling (not binding); Brier=0.17608 marginally regressed vs best 0.17605 (+0.017
134	2026-03-26T05:00:00Z	BTC	5m	DISCARD	0.17608	0.0054	56.19	78.92	BTC/5m stochastic re-run n_estimators=[100,800] + lr=[0.005,0.1] (strategy priority #3 from strategy after iter 131) -- BTC/5m stagnant since iter 104 (0 improvements); this run: restored n_estimators=[100,800] and lr=[0.005,0.1] (global default); SEVERE STARVATION: only 17/40 HPO trials completed; n_estimators=103 NEAR LOWER BOUND (100) -- optimization instability; lr=0.057532 within ceiling (not binding); Brier=0.17608 marginally regressed vs best 0.17605 (+0.017% marginal stochastic tie); best_params: n_estimators=103 lr=0.058 max_depth=5 num_leaves=79 min_child=794 reg_alpha=0.0 reg_lambda=0.586; KEY FINDINGS: (1) 17/40 trials = SEVERE starvation with 800 ceiling (worse than 1500 ceiling); (2) n_estimators=103 near lower bound -- BTC/5m HPO landscape non-smooth; (3) BTC/5m stagnation may be structural; FAIL: Brier 0.17608 > best 0.17605; WARNING: Sharpe=78.92>5.0 consistent BTC/5m sniper pattern; DISCARD	-	1782396.44	70.68	0.385	80965	0.6697	0.7261	0.168256135	2026-03-26T06:00:00Z	ETH	1h	DISCARD	0.211687	0.0162	73.67	71.53	ETH/1h n_splits=6 experiment (strategy priority #4 from strategy after iter 131) -- reduced walk_forward.n_splits from 8 to 6 to give HPO more time per trial for low-lr sniper asset; 32/40 HPO trials (mild starvation -- n_estimators=590 well within 1500 ceiling, not the driver); Brier=0.211687 marginally regressed vs best 0.211438 (+0.118% miss); best_params: n_estimators=590 lr=0.010273 max_depth=4 num_leaves=34 min_child=813 reg_alpha=0.211 reg_lambda=1e-6; lr=0.010273 consistent with ETH/1h sniper pattern (consistently near 0.009-0.010); n_splits=6 did NOT improve calibration -- larger folds did not help low-lr convergence as expected; tick-dominant ETH: WR=50.49%; top features: partial_bar_position partial_range elapsed_pct time_remaining_pct bar_position rsi_14 rsi_7 volume_sma_10 volume_ratio_partial distance_from_open; train_bars=10000 purge_period=24 n_splits=6; FAIL: Brier 0.211687 > best 0.211438 (0.118% miss); WARNING: Sharpe=71.53>5.0 consistent ETH/1h tick-dominant pattern; all 4 strategy items from strategy after iter 131 now complete (1-4 all DISCARD); next: autonomous -- BTC/1h n_estimators=[100,350] to resolve residual starvation (427 near 450 ceiling at iter 133)	-	5892771.43	71.46	0.075	19234	0.5049	0.6627	0.395166
136	2026-03-26T07:00:00Z	BTC	1h	KEEP	0.174676	0.0101	12.32	23.92	BTC/1h further ceiling reduction n_estimators=[100,350] + lr=[0.005,0.05] (autonomous -- iter 133 found n_estimators=427 near 450 ceiling); 37/40 HPO trials (improved from 38/40 at iter 133); n_estimators=350 AT ceiling (starvation persists -- BTC/1h genuine optimum may be below 350); lr=0.017289 well within 0.05 ceiling (lr resolved as non-binding); Brier=0.174676 NEW BEST (beat iter 107 best 0.174864 by 0.108136	2026-03-26T07:00:00Z	BTC	1h	KEEP	0.174676	0.0101	12.32	23.92	BTC/1h further ceiling reduction n_estimators=[100,350] + lr=[0.005,0.05] (autonomous -- iter 133 found n_estimators=427 near 450 ceiling); 37/40 HPO trials; n_estimators=350 AT ceiling (starvation persists); lr=0.017289 well within 0.05 ceiling (lr resolved); Brier=0.174676 NEW BEST (beat iter 107 best 0.174864 by 0.108%); best_params: n_estimators=350 lr=0.017289 max_depth=6 num_leaves=96 min_child=616 reg_alpha=0.001456 reg_lambda=3.4e-5; BTC sniper WR=63.59%; top features: distance_from_open vol_norm_distance partial_bar_position elapsed_pct time_remaining_pct trade_intensity hour_cos rsi_7 hour_sin bar_position; KEY FINDING: n_estimators=350 at ceiling -- optimum is below 350 -- further reduction to [100,250] warranted; improvement despite starvation confirms ceiling reduction strategy directionally correct; KEEP: Brier 0.174676 < best 0.174864 (0.108%); WARNING: Sharpe=23.92>5.0 consistent BTC/1h sniper pattern	-	180419.16	18.31	0.1989	16399	0.6359	0.7256	0.175703
137	2026-03-26T08:00:00Z	BTC	1h	DISCARD	0.175037	0.0109	12.36	23.45	BTC/1h further ceiling reduction n_estimators=[100,250] (autonomous -- iter 136 found n_estimators=350 AT ceiling); STARVATION FULLY RESOLVED: 40/40 HPO trials completed (first time for BTC/1h); n_estimators=230 NOT near 250 ceiling (optimum confirmed in 200-250 range); Brier=0.175037 marginally regressed vs best 0.174676 (+0.021% marginal miss); best_params: n_estimators=230 lr=0.037429 max_depth=5 num_leaves=76 min_child=594 reg_alpha=0.002092 reg_lambda=0.012118; lr=0.037 well within 0.05 ceiling (lr non-binding); KEY FINDING: [100,250] is the correct BTC/1h HPO range -- starvation resolved, n_estimators optimum ~230; stochastic re-run at [100,250] expected to find Brier < 0.174676 now that search is unobstructed; BTC sniper WR=63.04%; top features: vol_norm_distance distance_from_open elapsed_pct time_remaining_pct partial_bar_position trade_intensity rsi_7 hour_cos bar_position hour_sin; FAIL: Brier 0.175037 > best 0.174676; WARNING: Sharpe=23.45>5.0 consistent BTC/1h sniper pattern; DISCARD -- restore best_knobs_BTC_1h.json	-	174702.44	17.37	0.2	16330	0.6304	0.726	0.175614138	2026-03-26T09:00:00Z	BTC	1h	DISCARD	0.174979	0.0107	11.86	22.83	BTC/1h stochastic re-run n_estimators=[100,250] (autonomous -- iter 137 marginal miss 0.021%; starvation confirmed resolved); 40/40 HPO trials (starvation fully resolved again); n_estimators=182 NOT near 250 ceiling (optimum confirmed ~180-230 range); Brier=0.174979 marginally regressed vs best 0.174676 (+0.017% marginal miss); best_params: n_estimators=182 lr=0.036129 max_depth=5 num_leaves=83 min_child=628 reg_alpha=0.0 reg_lambda=0.0; lr=0.036 well within 0.05 ceiling (non-binding); BTC sniper WR=63.14%; top features: vol_norm_distance distance_from_open partial_bar_position time_remaining_pct elapsed_pct trade_intensity rsi_7 hour_cos hour_sin bar_position; KEY FINDING: two consecutive near-best stochastic runs (iter 137: 0.175037, iter 138: 0.174979) both missing by <0.03% -- BTC/1h Brier oscillating around 0.1746-0.1750 stochastic basin; [100,250] confirmed correct range (n_estimators=182 non-binding); consider different lever (reg_alpha/reg_lambda or feature subset) to escape basin; FAIL: Brier 0.174979 > best 0.174676; WARNING: Sharpe=22.83>5.0 consistent BTC/1h sniper pattern	-	170216.07	17.75	0.2144	16300	0.6314	0.7261	0.175674
138	2026-03-26T09:00:00Z	BTC	1h	DISCARD	0.174979	0.0107	11.86	22.83	BTC/1h stochastic re-run n_estimators=[100,250] (autonomous -- iter 137 marginal miss 0.021%; starvation confirmed resolved); 40/40 HPO trials (starvation fully resolved again); n_estimators=182 NOT near 250 ceiling (optimum confirmed ~180-230 range); Brier=0.174979 marginally regressed vs best 0.174676 (+0.017% marginal miss); best_params: n_estimators=182 lr=0.036129 max_depth=5 num_leaves=83 min_child=628 reg_alpha=0.0 reg_lambda=0.0; lr=0.036 well within 0.05 ceiling (non-binding); BTC sniper WR=63.14%; top features: vol_norm_distance distance_from_open partial_bar_position time_remaining_pct elapsed_pct trade_intensity rsi_7 hour_cos hour_sin bar_position; KEY FINDING: two consecutive near-best stochastic runs (iter 137: 0.175037, iter 138: 0.174979) both missing by <0.03% -- BTC/1h Brier oscillating around 0.1746-0.1750 stochastic basin; [100,250] confirmed correct range (n_estimators=182 non-binding); consider different lever to escape basin; FAIL: Brier 0.174979 > best 0.174676; WARNING: Sharpe=22.83>5.0 consistent BTC/1h sniper pattern	-	170216.07	17.75	0.2144	16300	0.6314	0.7261	0.175674139	2026-03-26T11:00:00Z	BTC	1h	DISCARD	0.175226	0.0109	12.08	22.74	BTC/1h reg_alpha widen to [0.1, 5.0] (strategy priority #1 from strategy after iter 136) -- stochastic basin escape attempt; keep n_estimators=[100,350]; rationale: iters 137/138 best_params showed reg_alpha~0 (0.002 and 0.0), forcing lower bound to 0.1 prevents near-zero collapse; 34/40 HPO trials (mild starvation with 350 ceiling); n_estimators=321 NOT near ceiling (optimum confirmed ~230-320 range, consistent with iter 137 finding n_estimators=230); best_params: n_estimators=321 lr=0.027719 max_depth=5 num_leaves=82 min_child=853 reg_alpha=0.1073 reg_lambda=0.0; reg_alpha=0.1073 near lower bound (0.1) -- HPO still gravitating to lower regularization but DID NOT collapse to zero (structural shift confirmed); lr=0.028 within ceiling (non-binding); Brier=0.175226 marginal miss vs best 0.174676 (+0.032% miss); KEY FINDING: reg_alpha forced out of zero-collapse by [0.1,5.0] lower bound, but 0.1073 still near lower bound -- HPO is exploring minimum viable regularization, not strong regularization; stochastic miss confirms BTC/1h basin is persistent; consider stochastic re-run at [0.1,5.0] range to confirm or try wider [0.5, 5.0] to push further from zero; FAIL: Brier 0.175226 > best 0.174676; WARNING: Sharpe=22.74>5.0 consistent BTC/1h sniper pattern	-	174053.65	17.45	0.2118	16262	0.6318	0.7258	0.175739
