iteration	timestamp	asset	timeframe	status	oos_brier	oos_ece	backtest_pnl	backtest_sharpe	description	commit	bs_pnl	bs_sharpe	backtest_max_dd	backtest_trades	backtest_win_rate	oos_accuracy	hpo_objective
140	2026-03-26T12:00:00Z	XRP	15m	DISCARD	0.221812	0.0314	295.11	142.81	XRP/15m reg_alpha widen to [0.1,5.0] + n_estimators=[100,400] (strategy priority #2 from strategy after iter 136) -- reg_alpha forced out of zero-collapse (best_params reg_alpha=0.284729 vs near-zero in prior runs); starvation persists 27/40 HPO trials with n_estimators=367 near 400 ceiling; Brier=0.221812 regressed vs best 0.218075 (+1.71%); KEY FINDING: reg_alpha lower bound 0.1 successfully prevents near-zero collapse (0.285 vs 5.8e-05 in iter 128) but insufficient to escape basin; n_estimators=367 near 400 ceiling confirms XRP/15m structural starvation persists at 400 ceiling; XRP/15m tick-dominant FLAT: WR=50.63%; top features: partial_bar_position distance_from_open partial_range bar_position rsi_14 body_ratio volume_sma_10 regime_vol_zscore vol_ratio rsi_7; best_params: n_estimators=367 lr=0.091 max_depth=6 num_leaves=54 min_child=473 reg_alpha=0.285 reg_lambda=1.600; reg_alpha pattern matches BTC/1h iter 139 (forced out of zero but near lower bound -- HPO explores minimum viable regularization); FAIL: Brier 0.221812 > best 0.218075 (1.71% regression); WARNING: Sharpe=142.81>5.0 consistent XRP/15m tick-dominant pattern	011f9f6	23610514.29	142.88	0.075	77353	0.5063	0.6417	0.499789
141	2026-03-26T13:30:00Z	XRP	5m	DISCARD	0.221725	0.0083	301.87	241.63	XRP/5m anti-starvation n_estimators=[100,600] (strategy priority #1 from strategy after iter 136/140 queue) -- XRP/5m has never received anti-starvation treatment; iter 112 showed 12/40 HPO trials at 1500 ceiling; this run: CRITICAL -- only 9/40 HPO trials completed (SEVERE starvation at 600 ceiling, worse than expected); n_estimators=431 NOT near 600 ceiling (starvation is NOT n_estimators-driven -- something else exhausting trial budget); Brier=0.221725 marginally regressed vs best 0.221503 (+0.10141	2026-03-26T13:30:00Z	XRP	5m	DISCARD	0.221725	0.0083	301.87	241.63	XRP/5m anti-starvation n_estimators=[100,600] (strategy priority #1 from strategy after iter 136/140 queue) -- XRP/5m has never received anti-starvation treatment; iter 112 showed 12/40 HPO trials at 1500 ceiling -- severe starvation; this run: CRITICAL -- only 9/40 HPO trials completed (SEVERE starvation at 600 ceiling, worse than expected); n_estimators=431 NOT near 600 ceiling (starvation is NOT n_estimators-driven -- dataset-size structural constraint like BTC/5m 929K samples); Brier=0.221725 marginally regressed vs best 0.221503 (+0.10% miss); best_params: n_estimators=431 lr=0.013 max_depth=4 num_leaves=77 min_child=266 reg_alpha=2.85 reg_lambda=1.13; KEY FINDING: reg_alpha=2.85 naturally high (NOT zero-collapse) -- XRP/5m does not have zero-collapse problem; starvation at 9/40 trials caused by dataset size (each trial 50s with 928K samples); XRP/5m is structural floor class; ceiling reduction strategy is ineffective here; tick-dominant XRP: WR=49.79%; top features: partial_bar_position partial_range elapsed_pct time_remaining_pct distance_from_open volume_ratio_partial rsi_14 trade_intensity; FAIL: Brier 0.221725 > best 0.221503; WARNING: Sharpe=241.63>5.0 consistent XRP/5m tick-dominant pattern; DISCARD -- restore best_knobs_XRP_5m.json	-	69253014.29	242.08	0.0688	80784	0.4979	0.6368	0.464186
143	2026-03-26T14:45:00Z	ETH	5m	DISCARD	0.212642	0.0036	310.33	245.58	ETH/5m reg_alpha=[0.1,5.0] + n_estimators=[100,800] (strategy priority #2 from strategy after iter 140 queue) -- ETH/5m baseline iter 117 best_params had reg_alpha=3e-6 (near-zero collapse); this run: SEVERE STARVATION -- only 6/40 HPO trials completed (dataset-size structural, 929K samples same class as XRP/5m/BTC/5m); n_estimators=564 NOT near 800 ceiling (starvation is NOT n_estimators-driven); reg_alpha=3.946 HIGH -- HPO successfully exploring higher regularization (NOT zero-collapse, forced by lower bound 0.1); lr=0.012721 within ceiling; best_params: n_estimators=564 lr=0.013 max_depth=4 num_leaves=77 min_child=266 reg_alpha=3.946 reg_lambda=1.131; Brier=0.212642 regressed vs best 0.211888 (+0.35143	2026-03-26T14:45:00Z	ETH	5m	DISCARD	0.212642	0.0036	310.33	245.58	ETH/5m reg_alpha=[0.1,5.0] + n_estimators=[100,800] (strategy priority #2 from strategy after iter 140 queue) -- ETH/5m baseline iter 117 best_params had reg_alpha=3e-6 (near-zero collapse); this run: SEVERE STARVATION -- only 6/40 HPO trials completed (dataset-size structural, 929K samples 50s/trial same class as XRP/5m/BTC/5m); n_estimators=564 NOT near 800 ceiling (starvation is NOT n_estimators-driven); reg_alpha=3.946 HIGH -- HPO successfully exploring higher regularization (NOT zero-collapse forced by lower bound 0.1); lr=0.012721 within ceiling; best_params: n_estimators=564 lr=0.013 max_depth=4 num_leaves=77 min_child=266 reg_alpha=3.946 reg_lambda=1.131; Brier=0.212642 regressed vs best 0.211888 (+0.35% miss); KEY FINDING: (1) starvation at 6/40 trials confirms ETH/5m is dataset-size structural; (2) reg_alpha=3.946 confirms [0.1,5.0] successfully prevents zero-collapse but cannot overcome starvation; (3) ETH/5m is structural floor class; tick-dominant ETH: WR=49.86%; top features: partial_bar_position partial_range elapsed_pct time_remaining_pct volume_ratio_partial rsi_14 parkinson_vol_10 distance_from_open rsi_7 williams_r; FAIL: Brier 0.212642 > best 0.211888; WARNING: Sharpe=245.58>5.0 consistent ETH/5m tick-dominant pattern	36685f1	69597185.71	245.87	0.0687	81000	0.4986	0.6578	0.286882
144	2026-03-26T15:30:00Z	ETH	1h	DISCARD	0.212163	0.0154	73.68	71.47	ETH/1h reg_alpha widen to [0.1,5.0] + n_estimators=[100,1500] (strategy priority #3 from strategy after iter 140 queue) -- ETH/1h has 0 improvements since iter 100 baseline (0.211438); iter 135 best_params had reg_alpha=0.211 naturally near 0.1-0.2 region; this run: MODERATE STARVATION -- 19/40 HPO trials completed (unexpected -- iter 135 was 32/40, iter 100 was 40/40; starvation may be run-to-run variance or dataset-size sensitivity); n_estimators=433 NOT near 1500 ceiling (starvation is not n_estimators-driven); reg_alpha=0.6398 HIGH and well above 0.1 lower bound (NOT zero-collapse -- [0.1,5.0] lower bound successfully anchors HPO; ETH/1h natural region is 0.1-0.6 confirmed); best_params: n_estimators=433 lr=0.018789 max_depth=4 num_leaves=48 min_child=504 reg_alpha=0.640 reg_lambda=0.006; Brier=0.212163 regressed vs best 0.211438 (+0.34% miss); KEY FINDINGS: (1) reg_alpha=0.640 confirms [0.1,5.0] is working -- ETH/1h does NOT have zero-collapse problem naturally but does explore below 0.1 without lower bound; (2) 19/40 starvation means search was not clean -- lower bound may have narrowed effective search space causing starvation; (3) pattern matches iter 143 ETH/5m (reg_alpha forced high, starvation present, Brier regressed); ETH/1h tick-dominant: WR=50.49%; top features: partial_bar_position partial_range elapsed_pct time_remaining_pct bar_position rsi_14 rsi_7 volume_sma_10 hour_cos distance_from_open; FAIL: Brier 0.212163 > best 0.211438 (0.34% miss); WARNING: Sharpe=71.47>5.0 consistent ETH/1h tick-dominant pattern; reg_alpha forcing strategy 0/3 KEEP (ETH/5m iter 143, ETH/1h iter 144, BTC/1h iter 139 all DISCARD); starvation-free ETH/1h reg_alpha test failed -- reg_alpha lever insufficient for ETH/1h; DISCARD -- restore best_knobs_ETH_1h.json	-	5893700.0	71.76	0.0738	19260	0.5049	0.661	0.395865
145	2026-03-26T16:30:00Z	XRP	15m	DISCARD	0.218848	0.0154	295.25	143.49	XRP/15m further ceiling reduction n_estimators=[100,300] (autonomous -- strategy item 4 pre-condition: fix starvation before reg_alpha; iter 132 had 29/40 trials at [100,400] with mild starvation); 23/40 HPO trials (starvation PERSISTS at 300 ceiling -- slightly worse than 29/40 at 400 ceiling); n_estimators=273 NOT near 300 ceiling (starvation is NOT n_estimators-driven -- structural dataset-size class like XRP/5m and BTC/5m); Brier=0.218848 regressed vs best 0.218075 (+0.35% miss); best_params: n_estimators=273 lr=0.020477 max_depth=4 num_leaves=48 min_child=473 reg_alpha=0.003 reg_lambda=2.5e-05; KEY FINDING: reducing ceiling from 400 to 300 did NOT resolve starvation (23/40 vs 29/40 at 400 ceiling -- slightly worse); n_estimators=273 not at ceiling confirms optimum is in 100-273 range but search budget exhaustion is structural (per-trial cost ~50s from dataset size); XRP/15m confirmed structural floor class -- ceiling reduction strategy exhausted; tick-dominant XRP: WR=50.63%; top features: partial_bar_position partial_range time_remaining_pct elapsed_pct distance_from_open; FAIL: Brier 0.218848 > best 0.218075; WARNING: Sharpe=143.49>5.0 consistent XRP/15m tick-dominant pattern; DISCARD -- restore best_knobs_XRP_15m.json	-	23616671.43	143.45	0.075	76545	0.5063	0.6479	0.502343
146	2026-03-26T18:00:00Z	BTC	5m	DISCARD	0.17606	0.0054	57.06	79.9	BTC/5m reg_alpha=[0.1,5.0] + n_estimators=[100,800] (strategy priority #1 from strategy after iter 145) -- BTC/5m pre-multi-tp best had reg_alpha=2.854 naturally high; this run: SEVERE STARVATION -- only 16/40 HPO trials completed (dataset-size structural, 929K samples ~50s/trial); n_estimators=103 NEAR LOWER BOUND 100 (same instability as iter 134 which also got n_estimators=103); reg_alpha=0.157347 NEAR LOWER BOUND 0.1 (HPO collapses to minimum viable L1 -- forced lower bound prevents zero-collapse but HPO still gravitates to minimum, not exploring [0.1,5.0] range); Brier=0.17606 marginally regressed vs best 0.17605 (+0.006% stochastic tie); best_params: n_estimators=103 lr=0.057532 max_depth=5 num_leaves=98 min_child=794 reg_alpha=0.157 reg_lambda=0.586; BTC sniper WR=66.87%; top features: vol_norm_distance distance_from_open partial_bar_position time_remaining_pct elapsed_pct trade_intensity rsi_7 partial_range volume_ratio_partial rsi_14; KEY FINDINGS: (1) 16/40 starvation confirms BTC/5m is dataset-size structural (929K samples); (2) reg_alpha lower-bound collapse confirms forcing strategy ineffective for BTC/5m same as all other assets; (3) n_estimators=103 near lower bound reconfirms HPO instability at BTC/5m scale; BTC/5m is now fully exhausted -- no remaining levers; reg_alpha forcing campaign 0/5 KEEP across all assets; FAIL: Brier 0.17606 > best 0.17605 (stochastic tie, 0.006% miss); WARNING: Sharpe=79.9>5.0 consistent BTC/5m sniper pattern; sanity 5/6 (Sharpe leakage check WARN); DISCARD -- restore best_knobs_BTC_5m.json	-	1792171.38	71.02	0.4005	80966	0.6687	0.7262	0.168219
147	2026-03-26T18:30:00Z	ETH	1h	DISCARD	0.211817	0.0184	73.68	71.42	ETH/1h anti-starvation n_estimators=[100,400] + reg_alpha=[1e-8,10.0] (strategy item 2) -- 40/40 HPO trials COMPLETE (starvation resolved); n_estimators=342 well within bounds; reg_alpha=0.004973 near-zero (tick-dominant ETH natural gravitates to minimal L1); Brier 0.211817 misses best 0.211438 (iter 100) by 0.00038 (0.18147	2026-03-26T18:30:00Z	ETH	1h	DISCARD	0.211817	0.0184	73.68	71.42	ETH/1h anti-starvation n_estimators=[100,400] (strategy item 2) -- 40/40 HPO trials COMPLETE starvation resolved; n_estimators=342 well within bounds; reg_alpha=0.004973 near-zero; Brier 0.211817 misses best 0.211438 iter 100 by 0.00038 stochastic proximity; ETH/1h structural floor confirmed; best_params: lr=0.020 max_depth=4 num_leaves=87 min_child=990 reg_alpha=0.005 reg_lambda=8.1e-05; item 2 EXHAUSTED; next: SOL/1h num_leaves=[16,64]+n_estimators=[100,400] item 3	1f879b1	5891685.71	71.37	0.0738	19246	0.5049	0.663	0.395204
148	2026-03-26T19:30:00Z	SOL	1h	KEEP	0.219333	0.0203	70.59	69.78	SOL/1h num_leaves=[16,64] + n_estimators=[100,400] (strategy item 3) -- narrowed num_leaves from [16,128] to [16,64] based on iter 101 multi-tp baseline (num_leaves=32) and iter 90 pre-multi-tp best (num_leaves=98); reduced n_estimators ceiling to [100,400] to prevent 1h starvation; STARVATION FULLY RESOLVED: 40/40 HPO trials COMPLETE (first SOL/1h full search); n_estimators=224 NOT near 400 ceiling (optimum confirmed in 200-250 range); num_leaves=46 within [16,64] (converged near middle of narrowed range -- confirms range was directionally correct); reg_alpha=0.000925 near-zero (tick-dominant SOL natural minimal L1 -- NOT zero-collapse, just minimal); lr=0.029 within ceiling; Brier=0.219333 NEW BEST (beat iter 125 best 0.220615 by 0.578149	2026-03-26T20:00:00Z	ETH	5m	DISCARD	0.212433	0.0091	309.8	244.9	ETH/5m purge_period=12 (strategy item 4) -- pre-multi-tp best at purge_period=12 (iter 29 KEEP 0.177773); multi-tp 5x sample density hypothesis; SEVERE STARVATION: 16/40 HPO trials (dataset-size structural 929K samples, same class as BTC/5m/XRP/5m); n_estimators=219 NOT near 800 ceiling (starvation is NOT n_estimators-driven); reg_alpha=0.000219 near-zero (tick-dominant ETH natural minimal L1); Brier=0.212433 regressed vs best 0.211888 (+0.025149	2026-03-26T20:00:00Z	ETH	5m	DISCARD	0.212433	0.0091	309.8	244.9	ETH/5m purge_period=12 (strategy item 4) -- pre-multi-tp best at purge_period=12 (iter 29 KEEP 0.177773); multi-tp 5x sample density hypothesis; SEVERE STARVATION: 16/40 HPO trials (dataset-size structural 929K samples); n_estimators=219 NOT near 800 ceiling (starvation NOT n_estimators-driven); reg_alpha=0.000219 near-zero (tick-dominant ETH natural minimal L1); Brier=0.212433 regressed vs best 0.211888 (+0.025%); best_params: n_estimators=219 lr=0.062824 max_depth=5 num_leaves=99 min_child=504 reg_alpha=0.000219 reg_lambda=0.884; tick-dominant ETH WR=49.87%; top features: partial_bar_position partial_range time_remaining_pct elapsed_pct parkinson_vol_10 volume_ratio_partial distance_from_open rsi_14 rsi_7 trade_intensity; KEY FINDING: purge_period reduction 24->12 did NOT improve ETH/5m; shorter purge does not benefit multi-tp 5x density hypothesis; ETH/5m structural floor confirmed; FAIL: Brier 0.212433 > best 0.211888; WARNING: Sharpe=244.9>5.0 tick-dominant; sanity 5/6 (Sharpe WARN); DISCARD -- restore best_knobs_ETH_5m.json	-	69636285.71	245.44	0.0687	81000	0.4987	0.6579	0.280518
149	2026-03-26T20:30:00Z	XRP	1h	KEEP	0.222676	0.0355	74.54	73.64	XRP/1h num_leaves=[16,48] + n_estimators=[100,400] (strategy item 5) -- HPO has consistently found num_leaves=34 for XRP/1h (iters 102 and 115 both converged to 34); narrowed num_leaves from [16,128] to [16,48] to focus HPO on known optimal region; reduced n_estimators ceiling from 1500 to 400 to prevent starvation; STARVATION FULLY RESOLVED: 40/40 HPO trials COMPLETE (full search achieved); n_estimators=207 NOT near 400 ceiling (optimum confirmed in 200-210 range); num_leaves=25 within [16,48] range (converged below 34 -- narrowed range shifted optimum slightly lower); reg_alpha=6e-06 near-zero (tick-dominant XRP natural minimal L1 -- consistent with prior runs); lr=0.049 within ceiling; Brier=0.222676 NEW BEST (beat iter 115 best 0.226907 by 1.8660st under 2% verification threshold, no verify run needed); best_params: n_estimators=207 lr=0.049 max_depth=5 num_leaves=25 min_child=890 reg_alpha=6e-6 reg_lambda=0.001; tick-dominant XRP WR=51.54% (FLAT pattern); top features: partial_bar_position partial_range distance_from_open bar_position rsi_14 rsi_7 elapsed_pct time_remaining_pct volume_ratio_partial volume_sma_10; KEY FINDINGS: (1) 40/40 trials confirms XRP/1h is NOT dataset-size starved at [100,400] ceiling; (2) num_leaves=25 vs prior runs num_leaves=34 -- narrowed range [16,48] enabled cleaner HPO in sub-32 region; (3) n_estimators=207 confirms 1h optimum in 200-250 range (matches SOL/1h=224 from iter 148); (4) starvation was ceiling-driven at 1500 -- now resolved at 400; PASS: Brier 0.222676 < best 0.226907; WARNING: Sharpe=73.64>5.0 consistent XRP/1h tick-dominant pattern; sanity 5/6 (Sharpe WARN); KEEP -- update best_knobs_XRP_1h.json	-	5976242.86	73.55	0.0625	18996	0.5154	0.6392	0.467155
150	2026-03-26T21:30:00Z	ETH	1h	DISCARD	0.211817	0.0184	73.68	71.42	ETH/1h num_leaves=[16,64] + n_estimators=[100,400] (autonomous -- parallel to SOL/1h iter 148 KEEP strategy) -- narrowed num_leaves from [16,128] to [16,64] based on iter 135/144 best_params convergence pattern (34,48) and ETH/1h flat landscape hypothesis; STARVATION FULLY RESOLVED: 40/40 HPO trials COMPLETE (starvation remains resolved as in iter 147); n_estimators=342 NOT near 400 ceiling (optimum stable in 300-400 range); num_leaves=20 converged to LOW END of [16,64] range -- ETH/1h prefers very low num_leaves (20 vs SOL/1h=46 and XRP/1h=25); reg_alpha=0.004973 near-zero (tick-dominant ETH natural minimal L1); lr=0.020449 within ceiling (consistent with ETH/1h sniper pattern lr~0.009-0.021); Brier=0.211817 MISSES best 0.211438 (iter 100) by 0.00038 (0.18150	2026-03-26T21:30:00Z	ETH	1h	DISCARD	0.211817	0.0184	73.68	71.42	ETH/1h num_leaves=[16,64] + n_estimators=[100,400] (autonomous -- parallel to SOL/1h iter 148 KEEP strategy) -- narrowed num_leaves from [16,128] to [16,64] based on iter 135/144 best_params convergence (34,48); STARVATION FULLY RESOLVED: 40/40 HPO trials COMPLETE; n_estimators=342 NOT near 400 ceiling (optimum stable in 300-400 range); num_leaves=20 converged to LOW END of [16,64] range (ETH/1h prefers very low num_leaves); reg_alpha=0.004973 near-zero (tick-dominant ETH natural minimal L1); lr=0.020449 within ceiling; Brier=0.211817 MISSES best 0.211438 (iter 100) by 0.00038 (0.18%); best_params: n_estimators=342 lr=0.020 max_depth=4 num_leaves=20 min_child=990 reg_alpha=0.005 reg_lambda=8.1e-05; tick-dominant ETH: WR=50.49%; top features: partial_bar_position partial_range elapsed_pct time_remaining_pct bar_position rsi_14 rsi_7 volume_sma_10 volume_ratio_partial distance_from_open; KEY FINDINGS: 40/40 trials starvation resolved; num_leaves=20 well below prior runs (87/34/48) -- low-leaf region preferred; identical Brier to iter 147 confirms ETH/1h landscape flat in 0.2114-0.2118 region; ETH/1h structural floor at 0.211438 genuine; FAIL: Brier 0.211817 > best 0.211438 (0.18% miss); WARNING: Sharpe=71.42>5.0 tick-dominant; sanity 5/6 (Sharpe WARN); DISCARD -- restore best_knobs_ETH_1h.json	-	5891685.71	71.37	0.0738	19246	0.5049	0.663	0.395204
151	2026-03-27T00:00:00Z	ETH	15m	DISCARD	0.210017	0.0251	291.72	141.72	ETH/15m num_leaves=[48,96] + n_estimators=[100,400] (strategy priority #1) -- narrowed num_leaves from [16,128] to [48,96] centering on iter 116 optimum (num_leaves=70); reduced n_estimators ceiling from 800 to 400 mirroring 1h success (SOL/1h iter 148 KEEP, XRP/1h iter 149 KEEP); 26/40 HPO trials (improved from 19/40 at iter 116 with 800 ceiling but DOUBLE STARVATION: n_estimators=379 near 400 ceiling AND num_leaves=94 near 96 ceiling); best_params: n_estimators=379 lr=0.065 max_depth=5 num_leaves=94 min_child=493 reg_alpha=2.7e-5 reg_lambda=0.002; both bounds binding simultaneously -- HPO wants higher num_leaves and higher n_estimators; Brier=0.210017 misses best 0.209819 (iter 96) by 0.000198 (0.094pct miss); tick-dominant ETH: WR=50.11%; top features: partial_bar_position partial_range time_remaining_pct elapsed_pct bar_position rsi_7 rsi_14 distance_from_open parkinson_vol_10 volume_sma_10; KEY FINDING: double ceiling starvation -- num_leaves=94 near 96 ceiling AND n_estimators=379 near 400 ceiling; ETH/15m behaves differently from ETH/1h (num_leaves=20); iter 116 found 70 at [16,128] suggesting true ETH/15m optimum is 70-94+; next test: widen num_leaves to [48,128] + keep n_estimators=[100,400] to let num_leaves escape upper bound; FAIL: Brier 0.210017 > best 0.209819 (0.094pct miss); WARNING: Sharpe=141.72>5.0 consistent ETH/15m tick-dominant pattern; sanity 5/6 (Sharpe WARN); DISCARD -- restore best_knobs_ETH_15m.json	-	23339571.43	141.83	0.0862	76632	0.5011	0.6688	0.29843
152	2026-03-22T12:00:00Z	ETH	15m	KEEP-VERIFIED	0.193035	0.0234	298.04	148.68	ETH/15m num_leaves=[64,128] + n_estimators=[100,500] (strategy priority #1 corrected) -- widened num_leaves from [48,96] to [64,128] to resolve iter 151 double-ceiling starvation (num_leaves=94 at 96 ceiling AND n_estimators=379 at 400 ceiling); widened n_estimators to [100,500] for additional headroom; STARVATION FULLY RESOLVED: num_leaves=103 (verify: 103) well within [64,128] ceiling, n_estimators=389 (verify: 389) well within [100,500] ceiling; 28/40 fast trials, 33/100 verify trials (dataset-size structural class, expected); cross_asset.enabled=true: btc_vol_norm_distance #1, btc_distance_from_open #2, btc_partial_bar_position #10 in top-10 (3/4 BTC features dominant); best_params verify: n_estimators=389 lr=0.024 max_depth=5 num_leaves=103 min_child=894 reg_alpha=0.001 reg_lambda=2.7e-5; tick-dominant ETH: WR=50.95152	2026-03-22T12:00:00Z	ETH	15m	KEEP-VERIFIED	0.193035	0.0234	298.04	148.68	ETH/15m num_leaves=[64,128] + n_estimators=[100,500] (strategy priority #1 corrected) -- widened num_leaves from [48,96] to [64,128] to resolve iter 151 double-ceiling starvation; widened n_estimators to [100,500] for headroom; STARVATION FULLY RESOLVED: num_leaves=103 well within [64,128] ceiling NOT at 128 bound; n_estimators=389 well within [100,500] ceiling NOT at 500 bound; 28/40 fast trials 33/100 verify trials (dataset-size structural class expected); cross_asset.enabled=true: btc_vol_norm_distance #1 btc_distance_from_open #2 btc_partial_bar_position #10 (3/4 BTC features in top-10); best_params verify: n_estimators=389 lr=0.024 max_depth=5 num_leaves=103 min_child=894 reg_alpha=0.001 reg_lambda=2.7e-5; tick-dominant ETH WR=50.95%; fast Brier=0.193172 verify Brier=0.193035 consistent; Brier=0.193035 NEW BEST (beat iter 116 best 0.208324 by 7.34%); WARNING: Sharpe=148.68>5.0 consistent ETH/15m tick-dominant pattern; sanity 5/6 (Sharpe WARN); KEEP-VERIFIED -- update best_knobs_ETH_15m.json	-	23627614.29	146.74	0.07	75372	0.5095	0.6988	0.197081
