iteration	timestamp	asset	timeframe	status	oos_brier	oos_ece	backtest_pnl	backtest_sharpe	description	commit	bs_pnl	bs_sharpe	backtest_max_dd	backtest_trades	backtest_win_rate	oos_accuracy	hpo_objective
153	2026-03-22T13:30:00Z	BTC	15m	DISCARD	0.17347	0.0153	43.19	42.45	BTC/15m num_leaves=[24,64] + n_estimators=[100,400] (strategy priority #2) -- narrowed num_leaves from [16,128] to [24,64] centering on iter 123 confirmed optimum (num_leaves=43); reduced n_estimators ceiling from 800 to 400 (iter 123 optimum n_est=235 well within range); 25/40 HPO trials (dataset-size partial class, consistent with BTC sniper pattern); STARVATION DETECTED: num_leaves=60 near 64 ceiling AND n_estimators=391 near 400 ceiling (double-ceiling starvation, same pattern as ETH/15m iter 151); best_params: n_estimators=391 lr=0.069 max_depth=6 num_leaves=60 min_child=587 reg_alpha=0.00022 reg_lambda=1.9e-5; BTC sniper WR=60.84154	2026-03-22T14:00:00Z	BTC	15m	DISCARD	0.173259	0.0192	43.59	43.61	BTC/15m num_leaves=[32,80] + n_estimators=[100,500] (strategy priority #2 corrected -- iter 153 double-ceiling starvation at [24,64]+[100,400]); starvation RESOLVED: num_leaves=45 NOT near 80 ceiling; n_estimators=441 NOT near 500 ceiling; 27/40 trials (dataset-size partial class expected); best_params: n_estimators=441 lr=0.071337 max_depth=5 num_leaves=45 min_child=701 reg_alpha=1e-6 reg_lambda=0.037; BTC sniper WR=61.27154	2026-03-22T14:00:00Z	BTC	15m	DISCARD	0.173259	0.0192	43.59	43.61	BTC/15m num_leaves=[32,80] + n_estimators=[100,500] (strategy priority #2 corrected -- iter 153 double-ceiling starvation at [24,64]+[100,400]); starvation RESOLVED: num_leaves=45 NOT near 80 ceiling; n_estimators=441 NOT near 500 ceiling; 27/40 trials (dataset-size partial class expected); best_params: n_estimators=441 lr=0.071337 max_depth=5 num_leaves=45 min_child=701 reg_alpha=1e-6 reg_lambda=0.037; BTC sniper WR=61.27%; top features: vol_norm_distance distance_from_open partial_bar_position time_remaining_pct elapsed_pct rsi_7 rsi_14 bar_position trade_intensity regime_vol_zscore; KEY FINDINGS: (1) double-ceiling starvation resolved num_leaves=45 well within [32,80]; (2) n_estimators=441 well within [100,500]; (3) Brier=0.173259 misses best 0.171809 iter 123 by 0.845pct stochastic variance or landscape issue; (4) num_leaves=45 vs iter 123 num_leaves=43 very close to confirmed optimum; (5) next: tighter narrowing [36,56] centering on 43-45 OR stochastic re-run at [32,80]+[100,500]; FAIL Brier 0.173259 > best 0.171809 0.845pct miss; WARNING Sharpe=43.61>5.0 consistent BTC/15m sniper pattern; sanity 5/6 (Sharpe WARN); DISCARD -- restore best_knobs_BTC_15m.json	-	597701.88	30.0	0.232	61986	0.6127	0.733	0.175294
155	2026-03-22T16:00:00Z	SOL	15m	KEEP-VERIFIED	0.200064	0.0059	292.92	146.47	SOL/15m num_leaves=[32,72] + n_estimators=[100,400] (strategy priority #3) -- starvation FULLY RESOLVED: num_leaves=43 (fast)/51 (verify) well within [32,72] ceiling; n_estimators=249 (fast)/269 (verify) well within [100,400] ceiling; 29/40 fast trials 36/100 verify trials (dataset-size structural class, expected consistent with SOL/15m history); cross_asset.enabled=true: btc_vol_norm_distance #1, btc_distance_from_open #2, btc_partial_bar_position #3 (3/4 BTC features dominant); best_params verify: n_estimators=269 lr=0.016 max_depth=6 num_leaves=51 min_child=433 reg_alpha=0.001 reg_lambda=0.000; fast Brier=0.199934 verify Brier=0.200064 consistent (0.065% delta); Brier=0.200064 NEW BEST (beat iter 130 best 0.215345 by 7.10%); tick-dominant SOL WR=50.62%; top features: btc_vol_norm_distance btc_distance_from_open btc_partial_bar_position partial_bar_position time_remaining_pct elapsed_pct trade_intensity rsi_14 rsi_7 partial_range; cross-timeframe SOL convergence: SOL/5m=47, SOL/15m=51, SOL/1h=46 (all three timeframes in 43-51 range, tightest cross-timeframe convergence confirmed); WARNING: Sharpe=146.47>5.0 consistent SOL/15m tick-dominant pattern; sanity 5/6 (Sharpe WARN); KEEP-VERIFIED -- update best_knobs_SOL_15m.json and save model	-	23289528.57	144.47	0.0512	75400	0.5062	0.6821	0.253259156	2026-03-22T18:30:00Z	ETH	5m	KEEP-VERIFIED	0.199722	0.0111	312.66	251.66	ETH/5m num_leaves=[64,128] + n_estimators=[100,500] (strategy priority #4) -- ETH/5m known optimum num_leaves=70 (iter 117) bracketed by [64,128]; starvation partially resolved: verify num_leaves=69 NOT at bound (well within [64,128]); n_estimators=315/334 well within [100,500] ceiling; 22/40 fast trials 37/100 verify trials (dataset-size structural class, expected; 22>=12 acceptance threshold met); cross_asset.enabled=true: btc_vol_norm_distance #1, btc_distance_from_open #2, btc_partial_bar_position #10 (3/4 BTC features in top-10 verify); best_params verify: n_estimators=315 lr=0.054 max_depth=5 num_leaves=69 min_child=661 reg_alpha=1e-6 reg_lambda=0.001447; tick-dominant ETH WR=50.73156	2026-03-22T18:30:00Z	ETH	5m	KEEP-VERIFIED	0.199722	0.0111	312.66	251.66	ETH/5m num_leaves=[64,128] + n_estimators=[100,500] (strategy priority #4) -- ETH/5m known optimum num_leaves=70 (iter 117) bracketed by [64,128]; starvation partially resolved: verify num_leaves=69 NOT at bound (well within [64,128]); n_estimators=315/334 well within [100,500] ceiling; 22/40 fast trials 37/100 verify trials (dataset-size structural class expected 22>=12 threshold met); cross_asset.enabled=true: btc_vol_norm_distance #1 btc_distance_from_open #2 btc_partial_bar_position #10 (3/4 BTC features in top-10 verify); best_params verify: n_estimators=315 lr=0.054 max_depth=5 num_leaves=69 min_child=661 reg_alpha=1e-6 reg_lambda=0.001447; tick-dominant ETH WR=50.73%; fast Brier=0.200086 verify Brier=0.199722 consistent (0.18pct delta); Brier=0.199722 NEW BEST sub-0.20 breakthrough (beat iter 117 best 0.211888 by 5.74pct); WARNING Sharpe=251.66>5.0 consistent ETH/5m tick-dominant pattern; sanity 5/6 (Sharpe WARN); KEEP-VERIFIED -- update best_knobs_ETH_5m.json save model	-	70235357.14	249.73	0.06	81000	0.5073	0.6808	0.193115
154	2026-03-22T14:00:00Z	BTC	15m	DISCARD	0.173259	0.0192	43.59	43.61	BTC/15m num_leaves=[32,80]+n_estimators=[100,500] starvation fix; starvation RESOLVED num_leaves=45 n_estimators=441; Brier misses best 0.171809 by 0.845pct; DISCARD	-	597701.88	30.0	0.232	61986	0.6127	0.733	0.175294
156	2026-03-22T18:30:00Z	ETH	5m	KEEP-VERIFIED	0.199722	-	-	-	ETH/5m num_leaves=[64,128]+n_estimators=[100,500] starvation fix; verify num_leaves=69; Brier=0.199722 NEW BEST sub-0.20 breakthrough beats iter 117 0.211888 by 5.74pct; KEEP-VERIFIED	-	70235357.14	249.73	-	227819	-	-	0.193115
157	2026-03-22T20:00:00Z	BTC	15m	DISCARD	0.171889	0.0121	49.87	52.27	BTC/15m num_leaves=[32,64] + n_estimators=[100,350] (strategy priority #1 -- precision refinement targeting iter 123 optimum num_leaves=43 n_est=235); starvation RESOLVED: num_leaves=46 NOT near 64 ceiling; n_estimators=111 NOT near 350 ceiling; 25/40 trials (dataset-size partial class expected); best_params: n_estimators=111 lr=0.061129 max_depth=6 num_leaves=46 min_child=925 reg_alpha=0.0 reg_lambda=0.046; BTC sniper WR=66.11157	2026-03-22T20:00:00Z	BTC	15m	DISCARD	0.171889	0.0121	49.87	52.27	BTC/15m num_leaves=[32,64] + n_estimators=[100,350] (strategy priority #1 -- precision refinement targeting iter 123 optimum num_leaves=43 n_est=235); starvation RESOLVED: num_leaves=46 NOT near 64 ceiling; n_estimators=111 NOT near 350 ceiling; 25/40 trials dataset-size partial class expected; best_params: n_estimators=111 lr=0.061129 max_depth=6 num_leaves=46 min_child=925 reg_alpha=0.0 reg_lambda=0.046; BTC sniper WR=66.11%; top features: vol_norm_distance distance_from_open partial_bar_position time_remaining_pct elapsed_pct trade_intensity rsi_7 bar_position rsi_14 volume_ratio_partial; KEY FINDINGS: (1) starvation fully resolved no double-ceiling; (2) n_est=111 VERY LOW vs iter 123 n_est=235 tighter range redirected HPO into low-n_est local minimum; (3) num_leaves=46 vs iter 123 num_leaves=43 consistent convergence 43-46 range (4th consecutive confirmation); (4) Brier=0.171889 misses best 0.171809 by 0.047pct stochastic tie; FAIL: Brier 0.171889 > best 0.171809 (0.047pct miss); WARNING: Sharpe=52.27>5.0 consistent BTC sniper; sanity 5/6 (Sharpe WARN); DISCARD -- BTC/15m structural floor at 0.171809 likely confirmed; next: SOL/5m item 2 or stochastic re-run BTC/15m	-	710997.31	41.72	0.2146	61990	0.6611	0.7356	0.175302
158	2026-03-22T21:30:00Z	SOL	5m	KEEP-VERIFIED	0.207246	0.0188	305.0	243.56	SOL/5m num_leaves=[28,68] + n_estimators=[100,400] (strategy priority #2) -- starvation FULLY RESOLVED: fast num_leaves=54 NOT near 68 ceiling; n_estimators=331 NOT near 400 ceiling; verify num_leaves=51 NOT at bound (43-51 cross-timeframe SOL convergence confirmed: SOL/5m=51 SOL/15m=51 SOL/1h=46); verify n_estimators=271 well within ceiling; 33/40 fast trials 42/100 verify trials (dataset-size structural class expected); cross_asset.enabled=true: btc_distance_from_open #1 btc_vol_norm_distance #2 btc_partial_bar_position #3 (3/4 BTC features dominant in verify); best_params verify: n_estimators=271 lr=0.072 max_depth=5 num_leaves=51 min_child=644 reg_alpha=0.0 reg_lambda=3.1e-05; fast Brier=0.207783 verify Brier=0.207246 consistent (0.26pct delta); Brier=0.207246 NEW BEST (beat iter 121 best 0.218058 by 4.96pct); tick-dominant SOL WR=49.55% (FLAT pattern); cross-timeframe SOL num_leaves convergence: SOL/5m=51 SOL/15m=51 SOL/1h=46 all in 43-51 range tightest cross-timeframe convergence confirmed; WARNING Sharpe=243.56>5.0 consistent SOL/5m tick-dominant pattern; sanity 5/6 (Sharpe WARN); KEEP-VERIFIED -- update best_knobs_SOL_5m.json save model	-	68722542.86	242.67	0.0688	80780	0.4955	0.6659	0.358793158	2026-03-22T21:30:00Z	SOL	5m	KEEP-VERIFIED	0.207246	0.0188	305.0	243.56	SOL/5m num_leaves=[28,68] + n_estimators=[100,400] (strategy priority #2) -- starvation FULLY RESOLVED: fast num_leaves=54 NOT near 68 ceiling; n_estimators=331 NOT near 400 ceiling; verify num_leaves=51 NOT at bound (cross-timeframe SOL convergence confirmed: SOL/5m=51 SOL/15m=51 SOL/1h=46 all in 43-51 range); verify n_estimators=271 well within ceiling; 33/40 fast trials 42/100 verify trials; cross_asset.enabled=true: btc_distance_from_open #1 btc_vol_norm_distance #2 btc_partial_bar_position #3 (3/4 BTC features dominant in verify); best_params verify: n_estimators=271 lr=0.072 max_depth=5 num_leaves=51 min_child=644 reg_alpha=0.0 reg_lambda=3.1e-05; fast Brier=0.207783 verify Brier=0.207246 consistent (0.26pct delta); Brier=0.207246 NEW BEST (beat iter 121 best 0.218058 by 4.96pct); tick-dominant SOL WR=49.55% (FLAT pattern); WARNING Sharpe=243.56>5.0 consistent SOL/5m tick-dominant; sanity 5/6 (Sharpe WARN); KEEP-VERIFIED -- update best_knobs_SOL_5m.json save model	-	68722542.86	242.67	0.0688	80780	0.4955	0.6659	0.358793
159	2026-03-22T23:00:00Z	XRP	15m	KEEP-VERIFIED	0.205323	0.0207	298.67	147.88	XRP/15m num_leaves=[32,80] + n_estimators=[100,600] (strategy priority #3) -- starvation confirmed structural (24/40 fast 28/100 verify, consistent with XRP/15m history 23-29/40); num_leaves=77 fast (NOT at 80 ceiling) num_leaves=50 verify (NOT at 80 ceiling; both free); n_estimators=521 fast / 595 verify (near 600 ceiling -- structural class); fast Brier=0.205265 verify Brier=0.205323 consistent (0.028pct delta); Brier=0.205323 NEW BEST (beat iter 128 best 0.218075 by 5.87pct); XRP cross-timeframe num_leaves: XRP/15m=50 XRP/1h=25 (low num_leaves preference confirmed); btc_vol_norm_distance #1 btc_distance_from_open #2 btc_partial_bar_position #3 (3/4 BTC cross-asset features dominant); tick-dominant XRP WR=50.77159	2026-03-22T23:00:00Z	XRP	15m	KEEP-VERIFIED	0.205323	0.0207	298.67	147.88	XRP/15m num_leaves=[32,80] + n_estimators=[100,600] (strategy priority #3) -- starvation confirmed structural (24/40 fast 28/100 verify, consistent XRP/15m history 23-29/40); num_leaves=77 fast (NOT at 80 ceiling) num_leaves=50 verify (NOT at 80 ceiling both free); n_estimators=521 fast 595 verify (near 600 ceiling structural class); fast Brier=0.205265 verify Brier=0.205323 consistent (0.028pct delta); Brier=0.205323 NEW BEST (beat iter 128 best 0.218075 by 5.87pct); XRP cross-timeframe num_leaves: XRP/15m=50 XRP/1h=25 (low num_leaves preference confirmed); btc_vol_norm_distance #1 btc_distance_from_open #2 btc_partial_bar_position #3 (3/4 BTC cross-asset features dominant); tick-dominant XRP WR=50.77%; best_params verify: n_estimators=595 lr=0.017 max_depth=6 num_leaves=50 min_child=572 reg_alpha=0.004 reg_lambda=0.0; WARNING Sharpe=147.88>5.0 consistent XRP/15m tick-dominant pattern; sanity 5/6 (Sharpe WARN); KEEP-VERIFIED -- update best_knobs_XRP_15m.json save model	-	23775400.0	146.22	0.0725	75720	0.5077	0.6725	0.425978
160	2026-03-22T16:51:31Z	ETH	1h	KEEP-VERIFIED	0.191504	0.0286	75.03	75.42	ETH/1h num_leaves=[16,32] + n_estimators=[100,400] (strategy priority #5 tiebreaker -- all items 1-3 complete) -- narrowed num_leaves from [16,64] to [16,32] targeting below-20 region (iters 147 and 150 both converged to num_leaves=20 at [16,64] and produced identical Brier=0.211817 missing best 0.211438); STARVATION RESOLVED: fast num_leaves=22 NOT near 32 ceiling; n_estimators=307 NOT near 400 ceiling; 40/40 fast trials 57/100 verify trials (dataset-size structural class ETH/1h starvation expected); cross_asset.enabled=true: btc_distance_from_open #1 btc_vol_norm_distance #2 btc_partial_bar_position #3 (3/4 BTC features dominant -- same pattern as ETH/15m ETH/5m); best_params verify: n_estimators=307 lr=0.019 max_depth=5 num_leaves=22 min_child=864 reg_alpha=0.0 reg_lambda=4.3e-5; fast Brier=0.191504 verify Brier=0.191504 consistent (0.000pct delta); Brier=0.191504 NEW BEST (beat iter 100 best 0.211438 by 9.43pct); tick-dominant ETH WR=52.37%; key finding: num_leaves=22 below prior convergence point of 20 (iters 147 150) -- ETH/1h true optimum is in 20-27 range near 22; SURPRISE: massive 9.43pct improvement despite the floor hypothesis -- cross-asset BTC features unlocked ETH/1h improvement (iter 100 pre-dates cross_asset=true); WARNING Sharpe=75.42>5.0 consistent ETH/1h tick-dominant pattern; sanity 5/6 (Sharpe WARN); KEEP-VERIFIED -- update best_knobs_ETH_1h.json save model	-	5952785.71	74.17	0.0625	18586	0.5237	0.7019	0.262576
161	2026-03-23T00:30:00Z	XRP	5m	KEEP-VERIFIED	0.209715	0.0154	305.87	247.77	XRP/5m num_leaves=[16,40] + n_estimators=[100,400] (strategy priority #6 SOFT BLACKLIST experiment) -- radical per-trial complexity reduction; XRP/1h converged to num_leaves=25 at iter 149 (XRP low num_leaves preference); TRIAL COUNT: 18/40 fast (>=10 acceptance threshold MET, NOT permanently blacklisted); 32/100 verify (structural dataset-size class expected); fast num_leaves=26 NOT at 40 ceiling (converged near XRP cross-timeframe optimum 25-26); fast n_estimators=154 NOT at 400 ceiling (optimum in 154-230 range); verify num_leaves=39 near 40 ceiling (upper bound slightly binding -- wider range may help further); verify n_estimators=230 well within [100,400]; fast Brier=0.209178 verify Brier=0.209715 consistent (0.26pct delta); Brier=0.209715 NEW BEST (beat iter 112 best 0.221503 by 5.34pct); XRP cross-timeframe num_leaves: XRP/5m=26-39 XRP/15m=50 XRP/1h=25 (low num_leaves preference confirmed all three timeframes); btc_vol_norm_distance #1 btc_distance_from_open #2 btc_partial_bar_position #3 (3/4 BTC features dominant in fast); verify top: btc_distance_from_open #1 btc_vol_norm_distance #2 distance_from_open #3; tick-dominant XRP WR=50.38pct (FLAT pattern); best_params verify: n_estimators=230 lr=0.098 max_depth=4 num_leaves=39 min_child=424 reg_alpha=0.0 reg_lambda=0.003; KEY FINDINGS: (1) 18/40 trials confirms XRP/5m NOT permanently blacklisted -- radical complexity reduction works; (2) num_leaves 26-39 range consistent with XRP/1h=25 -- XRP low-leaf preference cross-asset; (3) SOFT BLACKLIST strategy successful; all strategy items 1-6 now COMPLETE; next strategist evaluation needed; WARNING: Sharpe=247.77>5.0 consistent XRP/5m tick-dominant pattern; sanity 5/6 (Sharpe WARN); KEEP-VERIFIED -- update best_knobs_XRP_5m.json save model	-	69714785.71	246.56	0.0625	80785	0.5038	0.6603	0.369998162	2026-03-23T04:00:00Z	SOL	1h	KEEP-VERIFIED	0.207484	0.0154	72.0	71.02	SOL/1h cross-asset re-run num_leaves=[16,64] + n_estimators=[100,400] (strategy priority #1) -- SOL/1h iter 148 pre-dates cross-asset features (no BTC in top-10); STARVATION-FREE: fast num_leaves=48 NOT at 64 ceiling; verify num_leaves=27 NOT at 64 ceiling; n_estimators=354 verify NOT at 400 ceiling; fast 40/40 trials verify 100/100 trials; cross-asset dominant: btc_vol_norm_distance #1 btc_distance_from_open #2 btc_partial_bar_position #3 (fast) -- 3/4 BTC features in top-3 confirming universal cross-asset pattern; verify top: btc_vol_norm_distance #1 btc_distance_from_open #2; best_params verify: n_estimators=354 lr=0.094 max_depth=5 num_leaves=27 min_child=975 reg_alpha=0.0006 reg_lambda=0.0; fast Brier=0.201816 verify Brier=0.207484 (2.81pct delta -- fast/verify spread acceptable both clearly beat prior best); Brier=0.207484 NEW BEST (beat iter 148 best 0.219333 by 5.41pct); tick-dominant SOL WR=50.04pct (FLAT pattern); WARNING Sharpe=71.02>5.0 consistent SOL/1h tick-dominant pattern; sanity 5/6 (Sharpe WARN); KEEP-VERIFIED -- update best_knobs_SOL_1h.json save model	-	5729200.0	70.52	0.085	18992	0.5004	0.6675	0.28416

162	2026-03-23T04:00:00Z	SOL	1h	KEEP-VERIFIED	0.207484	0.0154	72.0	71.02	SOL/1h cross-asset re-run num_leaves=[16,64]+n_estimators=[100,400] (strategy priority #1) -- SOL/1h iter 148 pre-dates cross-asset features (no BTC in top-10); STARVATION-FREE: fast num_leaves=48 NOT at 64 ceiling; verify num_leaves=27 NOT at 64 ceiling; n_estimators=354 verify NOT at 400 ceiling; fast 40/40 trials verify 100/100 trials; cross-asset dominant: btc_vol_norm_distance #1 btc_distance_from_open #2 btc_partial_bar_position #3 (fast) -- 3/4 BTC features in top-3 confirming universal cross-asset pattern; verify top: btc_vol_norm_distance #1 btc_distance_from_open #2; best_params verify: n_estimators=354 lr=0.094 max_depth=5 num_leaves=27 min_child=975 reg_alpha=0.0006 reg_lambda=0.0; fast Brier=0.201816 verify Brier=0.207484 (2.81pct delta -- fast/verify spread acceptable both clearly beat prior best); Brier=0.207484 NEW BEST (beat iter 148 best 0.219333 by 5.41pct); tick-dominant SOL WR=50.04pct (FLAT pattern); WARNING Sharpe=71.02>5.0 consistent SOL/1h tick-dominant pattern; sanity 5/6 (Sharpe WARN); KEEP-VERIFIED -- update best_knobs_SOL_1h.json save model	cfc03b7	5729200.0	70.52	0.085	18992	0.5004	0.6675	0.28416
163	2026-03-23T07:30:00Z	XRP	1h	KEEP-VERIFIED	0.206414	0.0301	76.08	75.82	XRP/1h cross-asset re-run num_leaves=[16,48]+n_estimators=[100,400] (strategy priority #3) -- XRP/1h iter 149 pre-dates cross-asset features (no BTC in top-10); STARVATION-FREE: fast num_leaves=39 NOT at 48 ceiling; verify num_leaves=42 NOT at 48 ceiling; n_estimators=386 fast / 357 verify well within ceiling; fast 40/40 trials verify 82/100 trials (dataset-size structural class); cross-asset dominant: fast btc_distance_from_open #1 btc_vol_norm_distance #2; verify btc_vol_norm_distance #1 btc_distance_from_open #2 (2/4 BTC features in top-2 confirming universal cross-asset pattern); best_params verify: n_estimators=357 lr=0.064 max_depth=4 num_leaves=42 min_child=657 reg_alpha=0.000814 reg_lambda=0.018; fast Brier=0.208182 verify Brier=0.206414 consistent (0.85pct delta); Brier=0.206414 NEW BEST (beat iter 149 best 0.222676 by 7.30pct); XRP cross-timeframe num_leaves: XRP/5m=26-39 XRP/15m=50 XRP/1h=39-42 (mid-range leaves for 1h vs low for 5m); tick-dominant XRP WR=53.61pct; key findings: (1) 7.30pct improvement mirrors ETH/1h 9.43pct and SOL/1h 5.41pct -- cross-asset lever universal across all 1h timeframes; (2) num_leaves=39-42 at 1h vs 25 in iter 149 -- cross-asset richer representation needs more leaves; (3) XRP/1h sub-0.21 for first time; WARNING Sharpe=75.82>5.0 consistent XRP/1h tick-dominant pattern; sanity 5/6 (Sharpe WARN); KEEP-VERIFIED -- update best_knobs_XRP_1h.json save model	-	6057800.0	75.05	0.0625	18998	0.5361	0.665	0.305456164	2026-03-23T08:30:00Z	BTC	15m	DISCARD	0.172845	0.0153	45.05	46.95	BTC/15m FINAL ATTEMPT num_leaves=[32,64]+n_estimators=[150,350] (strategy priority #5 -- permanent floor declaration); ONLY 5/40 HPO trials (severe starvation -- [32,64]+[150,350] combination over-constrained large dataset); n_estimators=225 IN TARGET RANGE 200-250 (iter 123 optimum confirmed); num_leaves=51 within [32,64] (near iter 123 optimum 43-46); Brier=0.172845 MISSES best 0.171809 by 0.60pct; top features: vol_norm_distance distance_from_open partial_bar_position time_remaining_pct elapsed_pct trade_intensity rsi_7 bar_position rsi_14 regime_vol_zscore (NO cross-asset features -- BTC model uses tick features only, expected); BTC sniper WR=63.15 onsistent pattern; best_params: n_estimators=225 lr=0.086 max_depth=5 num_leaves=51 min_child=240 reg_alpha=0.625; PERMANENT FLOOR DECLARED: three consecutive near-best runs iter123=0.171809 iter157=0.171889 iter164=0.172845 -- HPO consistently finds n_est=200-250 and num_leaves=43-51 region but cannot breach 0.1718 threshold; structural floor confirmed; FAIL: Brier 0.172845 > best 0.171809; WARNING: Sharpe=46.95>5.0 consistent BTC/15m sniper pattern; sanity 5/6 (Sharpe WARN)	-	627676.99	34.25	0.175	61338	0.6315	0.7334	0.175551
