iteration	timestamp	asset	timeframe	status	oos_brier	oos_ece	backtest_pnl	backtest_sharpe	description	commit	bs_pnl	bs_sharpe	backtest_max_dd	backtest_trades	backtest_win_rate	oos_accuracy	hpo_objective
165	2026-03-23T09:30:00Z	XRP	5m	KEEP	0.209444	0.0111	309.06	247.94	XRP/5m ceiling widen num_leaves=[16,48]+n_estimators=[100,400] (strategy priority #6) -- iter 161 verify found num_leaves=39 near 40 ceiling (binding); widened upper bound from 40 to 48; STARVATION-FREE: 40/40 trials; num_leaves=29 NOT near 48 ceiling (HPO free to explore -- lower optimum than iter 161 verify=39); n_estimators=375 near 400 ceiling (structural class); Brier=0.209444 beats iter 161 best 0.209715 by 0.13pct (marginal improvement); XRP cross-timeframe num_leaves taxonomy updated: XRP/5m=26-39 fast / 29 fast-widen / 39 verify (low-leaf preference confirmed across all optimum finds); BTC cross-asset dominant: btc_distance_from_open #1 btc_vol_norm_distance #2 btc_partial_bar_position #4 btc_partial_range #10 (4/4 BTC features in top-10); best_params: n_estimators=375 lr=0.057 max_depth=3 num_leaves=29 min_child=558 reg_alpha=0.023 reg_lambda=0.0; tick-dominant XRP WR=50.29pct; improvement=0.13pct (below 2pct threshold -- no verify run required); KEY FINDINGS: (1) ceiling widen confirmed num_leaves optimum is in 26-39 range not 40-48 (HPO chose 29 with full freedom to 48); (2) marginal 0.13pct improvement -- XRP/5m structural floor near 0.2094; (3) n_estimators=375 near 400 ceiling but n_est ceiling is likely structural (consistent XRP 5m/1h pattern); WARNING Sharpe=247.94>5.0 consistent XRP/5m tick-dominant pattern; sanity 5/6 (Sharpe WARN); KEEP -- new best 0.209444 (marginal); final strategy priority #6 COMPLETE	-	69696057.14	246.56	0.0638	80782	0.5029	0.66	0.36974
166	2026-03-23T12:00:00Z	ETH	1h	DISCARD	0.194817	0.0335	74.85	74.23	ETH/1h specialist split enabled boundary=0.4 early=[0.1,0.2] late=[0.4,0.6,0.8] num_leaves=[16,32] n_estimators=[100,400] -- early_brier=0.230068 late_brier=0.171316 combined=0.194817; early sub-model weak (0.2301 drags combined above unified 0.1915); late sub-model excellent (0.1713) but early lacks signal at t=0.1/0.2; FAIL: Brier 0.194817 > best 0.191504 (regression 1.73%); specialist split DISCARD -- structural finding: early snapshots lack sufficient signal for sub-model to beat unified; WARNING: Sharpe=74.23>5.0 consistent ETH/1h tick-dominant pattern; sanity 5/6 (Sharpe leakage check WARN); best_params_early: n_estimators=158 lr=0.088 num_leaves=16 min_child=522; best_params_late: n_estimators=346 lr=0.094 num_leaves=22 min_child=720	-	-	-	0.0675	18652	0.5132	0.6974	0.387395
167	2026-03-23T13:00:00Z	SOL	15m	DISCARD	0.200361	0.0086	292.6	146.64	SOL/15m specialist split enabled boundary=0.4 early=[0.1,0.2] late=[0.4,0.6,0.8] num_leaves=[32,72] n_estimators=[100,400] -- early_brier=0.231347 late_brier=0.179703 combined=0.200361; FAIL: Brier 0.200361 > best 0.200064 (regression 0.15167	2026-03-23T13:00:00Z	SOL	15m	DISCARD	0.200361	0.0086	292.6	146.64	SOL/15m specialist split enabled boundary=0.4 early=[0.1,0.2] late=[0.4,0.6,0.8] num_leaves=[32,72] n_estimators=[100,400] -- early_brier=0.231347 late_brier=0.179703 combined=0.200361; FAIL: Brier 0.200361 > best 0.200064 regression 0.15%; structural pattern confirmed: early sub-model weak at t=0.1/0.2 0.2313 matches ETH/1h iter166 pattern 0.2301; late sub-model excellent 0.1797 but early always drags combined above unified; hpo_trials=20 STARVATION specialist doubles model count halves trials per sub-model; early_params: n_estimators=279 lr=0.079 num_leaves=40 min_child=140; late_params: n_estimators=325 lr=0.043 num_leaves=36 min_child=950; cross-asset still dominant: btc_vol_norm_distance #1 btc_distance_from_open #2; specialist lever CLOSED boundary=0.4 across ETH/1h+SOL/15m; WARNING Sharpe=146.64>5.0 consistent SOL/15m tick-dominant pattern; sanity 5/6 Sharpe WARN	6380ce8	-	-	0.05	75119	0.5055	0.6839	0.389958
168	2026-03-23T14:00:00Z	BTC	1h	DISCARD	0.175038	0.0108	12.35	23.43	BTC/1h stochastic re-run num_leaves=[48,96]+n_estimators=[100,250] (strategy priority #3) -- iters 137-138 used [100,250] with free num_leaves=[32,96] and found optimal 76-83; this run narrows num_leaves to [48,96] centering on confirmed optimum; STARVATION-FREE: 40/40 HPO trials; n_estimators=230 NOT near 250 ceiling (optimum in 200-250 range confirmed for 3rd time); num_leaves=91 NEAR 96 ceiling (unexpected: HPO chose near-ceiling vs prior 76-83 -- stochastic landscape shift); Brier=0.175038 marginally regressed vs best 0.174676 (+0.021168	2026-03-23T14:00:00Z	BTC	1h	DISCARD	0.175038	0.0108	12.35	23.43	BTC/1h stochastic re-run num_leaves=[48,96]+n_estimators=[100,250] (strategy priority #3) -- iters 137-138 used [100,250] with free num_leaves=[32,96] and found optimal 76-83; this run narrows num_leaves to [48,96] centering on confirmed optimum; STARVATION-FREE: 40/40 HPO trials; n_estimators=230 NOT near 250 ceiling (optimum in 200-250 range confirmed for 3rd time); num_leaves=91 NEAR 96 ceiling (unexpected: HPO chose near-ceiling vs prior 76-83 -- stochastic landscape shift); Brier=0.175038 marginally regressed vs best 0.174676 (+0.021%); best_params: n_estimators=230 lr=0.037 max_depth=5 num_leaves=91 min_child=594 reg_alpha=0.002 reg_lambda=0.012; lr=0.037 non-binding; KEY FINDING: num_leaves converged to 91 near 96 ceiling vs prior 76-83 -- narrowing did not help; BTC/1h landscape oscillates stochastically in 0.1746-0.1750 basin regardless of num_leaves range; DISCARD: BTC/1h permanent structural floor 0.174676 declared; BTC sniper WR=63.01%; WARNING Sharpe=23.43>5.0 consistent BTC/1h sniper pattern; sanity 5/6 (Sharpe WARN)	-	174661.33	17.37	0.2	16331	0.6301	0.726	0.175613
169	2026-03-23T15:30:00Z	SOL	1h	KEEP-VERIFIED	0.202166	0.0159	71.89	70.93	SOL/1h num_leaves narrowing [20,40]+n_estimators=[100,400] (strategy priority #4) -- iter 162 verify found num_leaves=27 at [16,64] with fast=48 (large fast/verify discrepancy 2.81pct); narrowed to [20,40] centering on confirmed 27 optimum; STARVATION-FREE: fast 40/40 trials verify 100/100 trials; num_leaves=36 NOT near 40 ceiling (HPO free within range); n_estimators=348 NOT near 400 ceiling; fast Brier=0.202164 verify Brier=0.202166 (0.001pct delta -- near-perfect stability); Brier=0.202166 NEW BEST (beat iter 162 best 0.207484 by 2.56pct); best_params: n_estimators=348 lr=0.029 max_depth=3 num_leaves=36 min_child=997 reg_alpha=4.6e-5 reg_lambda=5.9e-5; cross-asset dominant: btc_vol_norm_distance #1 btc_distance_from_open #2 btc_partial_bar_position top-6 (3/4 BTC features in top-10); tick-dominant SOL WR=51.07pct (FLAT pattern); KEY FINDINGS: (1) narrowing [16,64] to [20,40] confirmed num_leaves optimum shifted from 27 to 36 -- the [16,64] search was suboptimal in the 30-40 sub-region; (2) 0.001pct fast/verify delta is best stability in the program (near-deterministic convergence at [20,40]); (3) n_estimators=348 repeatable across fast and verify confirming 300-400 is SOL/1h true range; (4) strategy priority #4 COMPLETE -- narrowing was correct call; next: priority #5 XRP/15m n_est ceiling widen [100,800]+num_leaves=[32,80]; WARNING Sharpe=70.93>5.0 consistent SOL/1h tick-dominant pattern; sanity 5/6 (Sharpe WARN); KEEP-VERIFIED -- update best_knobs_SOL_1h.json save model	e21c49d	5725157.14	70.55	0.0875	19295	0.5107	0.6777	0.286062
170	2026-03-23T16:00:00Z	XRP	15m	DISCARD	0.20593	0.026	298.56	147.63	XRP/15m n_estimators ceiling widen [100,800]+num_leaves=[32,80] (strategy priority #5) -- iter 159 verify found n_est=595 near 600 ceiling; widened to 800 to escape ceiling; STARVATION STRUCTURAL: 18/40 HPO trials (consistent XRP/15m history); n_estimators=777 NEAR 800 ceiling (ceiling still binding even at 800; HPO wants >777 -- architectural floor confirmed); num_leaves=32 AT LOWER BOUND of [32,80] (HPO chose minimum vs iter 159 verify=50 -- landscape shift under wider n_est range); Brier=0.20593 MISSES best 0.205323 (iter 159) by 0.29pct (0.000607 miss); BTC cross-asset dominant: btc_vol_norm_distance #1 btc_distance_from_open #2 btc_partial_bar_position #6 (3/4 BTC features in top-10); best_params: n_estimators=777 lr=0.021815 max_depth=6 num_leaves=32 min_child=634 reg_alpha=0.000794 reg_lambda=0.0; tick-dominant XRP WR=51.16pct; KEY FINDINGS: (1) n_est ceiling pressure persists at 800 -- XRP/15m structurally requires >800 trees or the landscape is truly flat; (2) num_leaves=32 (floor) vs iter 159 verify=50 -- wider n_est range changes leaf optima; (3) 0.29pct miss confirms XRP/15m at structural floor near 0.2053; strategy priority #5 COMPLETE -- ceiling raise did not escape floor; WARNING: Sharpe=147.63>5.0 consistent XRP/15m tick-dominant pattern; sanity 5/6 (Sharpe WARN); DISCARD -- restore best_knobs_XRP_15m.json	-	23781614.29	146.4	0.0712	76290	0.5116	0.6709	0.426449171	2026-03-23T17:30:00Z	ETH	1h	KEEP	0.190875	0.0296	75.02	75.13	walk-forward train_bars=12000 (strategy priority #1 post-COMPLETE); richer cross-asset feature space benefits from more training data; Brier 0.191504->0.190875 (0.33 0mprovement); num_leaves=24 in [16,32]; top SHAP: btc_distance_from_open/btc_vol_norm_distance/btc_partial_bar_position	-	5952314.29	74.14	0.065	18710	0.5209	0.704	0.263629
171	2026-03-23T17:45:00Z	ETH	1h	KEEP	0.190875	0.0296	75.02	-	ETH/1h train_bars=12000 walk-forward config (strategy priority #1 post-COMPLETE); Brier 0.191504->0.190875 (0.33 0mprovement); walk-forward config lever confirmed effective; top SHAP: btc_distance_from_open/btc_vol_norm_distance/btc_partial_bar_position; tick-dominant ETH WR=50+pct; best_params: train_bars=12000; 40/40 HPO trials starvation-free; hpo_obj=0.263629; improvement=0.33pct (below 2pct threshold no verify required); sanity 5/6 (Sharpe WARN consistent ETH/1h tick-dominant pattern); KEEP -- new best ETH/1h 0.190875	7836170	5952314.29	74.14	0.065	18710	-	-	0.263629
172	2026-03-23T18:30:00Z	SOL	5m	KEEP-VERIFIED	0.206907	0.0165	306.69	244.48	SOL/5m train_bars 10000->12000 (strategy priority -- same lever as ETH/1h iter 171 KEEP); Brier 0.218209->0.206907 (5.17% improvement); verify Brier=0.206907 confirms fast Brier=0.206906 consistent; 33/40 fast trials 38/100 verify trials (structural dataset-size class); BTC cross-asset features dominant: btc_distance_from_open #1 btc_vol_norm_distance #2 btc_partial_bar_position #3 (3/4 BTC features in top-4); tick-dominant SOL WR=49.8pct; best_params: n_estimators=372 lr=0.061 max_depth=4 num_leaves=64 min_child=699 reg_alpha=0.0 reg_lambda=0.0; KEY INSIGHT: train_bars=12000 benefits SOL/5m as it benefits ETH/1h -- richer history improves BTC cross-asset feature learning; time_remaining_pct #3 (tick-dominant SOL confirmed, flat pattern); fast Brier=0.206906 verify Brier=0.206907 consistent within noise; improvement=5.17pct exceeds 2pct threshold -- KEEP-VERIFIED; WARNING: Sharpe=244.48>5.0 consistent SOL/5m tick-dominant pattern; sanity 5/6 (Sharpe WARN)	f0890c5	68754628.57	242.81	0.0675	80780	0.498	0.6664	0.34719173	2026-03-23T19:15:00Z	SOL	1h	KEEP	0.202164	0.0159	71.89	70.93	SOL/1h train_bars 10000->12000 (strategy priority #1 post-COMPLETE -- same lever as ETH/1h iter 171 KEEP and SOL/5m iter 172 KEEP-VERIFIED); Brier 0.202166->0.202164 (0.001% improvement -- noise-level); train_bars=12000 confirmed no meaningful change for SOL/1h (iter 169 optimum already fully dialed-in); best_params: n_estimators=348 lr=0.029 max_depth=3 num_leaves=36 min_child=997 IDENTICAL to iter 169 verify params (near-deterministic convergence); cross-asset dominant: btc_vol_norm_distance #1 btc_distance_from_open #2 btc_partial_bar_position #4 (3/4 BTC features in top-10); tick-dominant SOL WR=51.07%; 40/40 HPO trials starvation-free; hpo_obj=0.286062; improvement=0.001pct (below 2pct threshold -- no verify required); KEY FINDING: train_bars lever exhausted for SOL/1h -- iter 169 num_leaves narrowing had already found near-optimal basin; richer training data did not shift optimum; all 3 train_bars=12000 experiments completed: ETH/1h +0.33% SOL/5m +5.17% SOL/1h +0.001% -- lever only meaningful when prior HPO was underfitting due to dataset size; WARNING: Sharpe=70.93>5.0 consistent SOL/1h tick-dominant pattern; sanity 5/6 (Sharpe WARN); KEEP -- new best SOL/1h 0.202164 (marginal)	-	5725157.14	70.55	0.0875	19295	0.5107	0.6777	0.286062
174	2026-03-23T20:00:00Z	XRP	15m	KEEP	0.205184	0.019	298.58	147.4	XRP/15m n_estimators ultra-high ceiling [100,1200]+num_leaves=[40,60] (strategy priority #2 post-COMPLETE) -- iter 170 found n_est=777 near 800 ceiling; ceiling raised to 1200 to escape starvation; SEVERE STARVATION: 13/40 HPO trials (1200-tree runs too slow); n_estimators=1164 NEAR 1200 ceiling (ceiling STILL binding even at 1200 -- structural n_est floor confirmed); num_leaves=60 AT CEILING of [40,60]; Brier=0.205184 marginally beats best 0.205323 (iter 159) by 0.07% (0.000139 improvement -- near-noise); best_params: n_estimators=1164 lr=0.007602 max_depth=6 num_leaves=60 min_child=592 reg_alpha=0.001132 reg_lambda=3.6e-5; BTC cross-asset dominant: btc_vol_norm_distance #1 btc_distance_from_open #2 btc_partial_bar_position #4 (3/4 BTC features in top-10); tick-dominant XRP WR=50.68174	2026-03-23T20:00:00Z	XRP	15m	KEEP	0.205184	0.019	298.58	147.4	XRP/15m n_estimators ultra-high ceiling [100,1200]+num_leaves=[40,60] (strategy priority #2 post-COMPLETE) -- iter 170 found n_est=777 near 800 ceiling; ceiling raised to 1200 to escape starvation; SEVERE STARVATION: 13/40 HPO trials; n_estimators=1164 NEAR 1200 ceiling (still binding even at 1200 -- structural n_est floor confirmed); num_leaves=60 AT CEILING of [40,60]; Brier=0.205184 marginally beats best 0.205323 (iter 159) by 0.07% (near-noise); best_params: n_estimators=1164 lr=0.007602 max_depth=6 num_leaves=60 min_child=592 reg_alpha=0.001132 reg_lambda=3.6e-5; BTC cross-asset dominant: btc_vol_norm_distance #1 btc_distance_from_open #2 btc_partial_bar_position #4 (3/4 BTC in top-10); tick-dominant XRP WR=50.68%; KEY FINDINGS: (1) n_est ceiling persists at 1200 -- XRP/15m structurally requires >1200 trees or landscape is flat; (2) num_leaves=60 at ceiling; (3) 13/40 trials (starvation worsens at higher ceiling); (4) 0.07% improvement barely crosses KEEP threshold -- structural floor near 0.2053 confirmed; strategy priority 2 COMPLETE; WARNING Sharpe=147.4>5.0 consistent XRP/15m tick-dominant pattern; sanity 5/6 (Sharpe WARN); KEEP -- marginal new best XRP/15m 0.205184	-	23777257.14	146.38	0.0737	76628	0.5068	0.6726	0.425338
175	2026-03-23T20:45:00Z	SOL	5m	DISCARD	0.206928	0.0166	306.5	244.4	SOL/5m num_leaves narrowing [25,45]+n_estimators=[100,400] (strategy priority #3 post-COMPLETE) -- analogous to SOL/1h narrowing iter 169 (2.56% improvement); iter 172 found num_leaves=64 AT ceiling of [28,68]; STARVATION REDUCED: 31/40 trials (vs 33/40 iter 172 -- small improvement from narrower range); num_leaves=38 NOT near 45 ceiling (HPO chose mid-range with full freedom); n_estimators=372 near 400 ceiling (structural class -- same as iter 172); Brier=0.206928 MISSES best 0.206907 (iter 172) by 0.000021 (0.01% -- noise-level regression); best_params: n_estimators=372 lr=0.061 max_depth=4 num_leaves=38 min_child=699 reg_alpha=0.0 reg_lambda=0.0; KEY FINDINGS: (1) HYPOTHESIS FALSIFIED -- narrowing did NOT reveal better basin; num_leaves optimum is NOT in 25-38 range; iter 172 num_leaves=64 was genuinely optimal (HPO needs space to go to 64); (2) best_params nearly IDENTICAL to iter 172 (n_est=372 same, lr=0.061 same, num_leaves=38 vs 64); SOL/5m does NOT follow SOL/1h pattern (which shifted from 27 to 36 under narrowing); (3) structural difference: SOL/1h optimum was under-explored in 30-40 range; SOL/5m optimum genuinely prefers higher leaves (64 ceiling); BTC cross-asset dominant: btc_distance_from_open #1 btc_vol_norm_distance #2 btc_partial_bar_position #3 (3/4 BTC features in top-3); tick-dominant SOL WR=49.81%; FAIL: Brier 0.206928 > best 0.206907 (marginal regression 0.01%); WARNING: Sharpe=244.4>5.0 consistent SOL/5m tick-dominant pattern; sanity 5/6 (Sharpe WARN); DISCARD -- SOL/5m structural floor confirmed near 0.2069; strategy priority #3 COMPLETE -- all post-COMPLETE priorities exhausted	-	68752357.14	242.79	0.0675	80780	0.4981	0.6665	0.347191
